order,timestamp_ms,video_id,flag_count,like_count,view_count,comment_count,title
1483,5.3192,9d5YJ33hK7E,4,13389,534004,2041,Dream's History of Faked Stunts
1484,5.3212,9bnECGJY7cU,5,3721,67532,944,Winning* $1,000,000 from ROBLOX
1485,5.3233,9aiTXD4WN5g,1,43935,2113809,2173,Coraline being a MOOD for over 6 minutes straight
1486,5.3253,9XY4etMaaHM,0,480163,27006203,42214,I Built 4 SECRET Rooms in ONE COLOR!
1487,5.3273,9WCMxmnMInQ,0,93857,7786492,12488,MINECRAFT Shorts at DIFFERENT AGES!
1488,5.3294,9Un2CD5Cgd4,0,44859,2242013,1366,Spooder-Man Destroys Fortnite
1489,5.3313,9RurIn0OTL8,0,22566,1222375,1417,What if EVERYONE had RANDOM inputs in Mario Party?
1490,5.3332,9RkeppfNvP0,1,235341,22519413,23596,Will It Popsicle? Taste Test
1491,5.3508,yfOJ0PmWlp0,2,6792,144160,666,I Tried To Win Minecraft's Biggest Tournament
1492,5.3529,yTrIfkAb-_8,0,234494,25681387,22845,Will It Deep Fry? - Taste Test
1493,5.3547,tE_b7Y1wf-4,0,26080,2036262,1920,Playing Alien Autopsy
1494,5.3567,ssrgV03hGZE,1,28636,716929,1476,I Paid Bakeries $5000 To Recreate AI Cakes!
1495,5.3587,r01P9RmMeBI,0,221370,26232463,24995,Making Real Food w/ Play-Doh Toys
1496,5.3607,qZfVh8yRpC0,6,23379,366931,913,Brutally Honest Travel Gear Review
1497,5.3628,qRVVl0N0KGM,5,35864,2675764,3724,Mystery Popsicle Taste Test
1498,5.3647,nwQvMF-Rm4k,0,213793,7556973,14795,Debunking Can you make ICE in a microwave? Debunking Fake Videos Ann Reardon 2021
1499,5.3668,Nj3qoo750_I,0,269366,25289632,30307,Will It Ice Cream Sandwich? Taste Test
1500,5.3689,Ip0XlEmJafk,0,221637,20756047,27364,Will It Cereal? Taste Test
1501,5.3711,9RhWXPcKBI8,0,6496241,357432432,93073,Survive 100 Days Trapped, Win $500,000
1502,5.3731,9QFp7WpC838,0,17027,716440,348,a mod that adds surgery to minecraft
1503,5.3751,9OE8Mpv_FVI,0,17675,877973,1347,you laugh, caseoh jumps on me
1504,5.3771,9G6U7InIsFg,0,2816,78689,291,World’s *WEIRDEST* Animations Ever
1505,5.395,sHDGODl3ChI,0,11701,742626,972,IMPOSSIBLE Rides that ACTUALLY Exist
1506,5.3971,rZjvusR41HY,0,6129,466734,155,Movies Before and After Special Effects!
1507,5.3991,pqYYaq7JMO0,0,6800,488526,726,CRAZIEST Experiments In The World!
1508,5.4011,pcv5YLx_KHQ,0,14111,721714,712,World's Most *SATISFYING* Minecraft Shorts
1509,5.4032,iQTnWzfeGPI,0,55921,5440403,2333,Busting EVERY Movie Myth In REAL LIFE!
1510,5.4053,SncUwf6lf2g,1,55063,3208391,3505,Minecraft’s Most Viewed Shorts On Youtube
1511,5.4074,O2dN7CcHnSc,0,5849,539416,916,A Game About Digging a Hole
1512,5.4097,9EhQbQpRXC4,1,3700,297303,452,I ESCAPED My STRICT Parents House! (Schoolboy Runaway)
1513,5.4118,9DnYjZ1g8XU,0,11059,241627,2232,Minecraft - My New Pet [711]
1514,5.4137,9DGbejwKObU,2,3700,190082,410,The END IS COMING In Roblox!
1515,5.4156,99fmD2jv_Dw,0,18748,627115,4080,BeckBros React To Elimination Stickman Race!
1516,5.4176,93n-NH9mEL8,5,72887,11655669,6714,I Built Minecraft's Safest Civilization
1517,5.4196,93jLADJX7SY,1,14925,575102,684,I Recreated Minecraft's Most Nostalgic Builds
1518,5.4217,93dQiIVvvfI,1,10034,749697,2326,Reacting to All Your Pain in One Video!
1519,5.4237,91ZP0e-RSGA,0,22,2166,0,🌧️ Chill LoFi Beats with Red 🐼 | Study, Relax & Vibe ✨ [LIVE 24/7]
1520,5.4257,915nrUJohQ4,0,223780,22799258,48482,New Puppy Surprise! *Emotional*
1521,5.4277,8z3LCjRLgEI,1,20180,6106675,1238,New Best Ben Azelart TikTok Compilations 2023 - New Funny Tik Tok Memes - Let the Fun
1522,5.4296,8xcFs5LHy4E,1,16256,5312054,2590,Minecraft Xbox - Legend Of The Holy Grail - Lava Parkour [3]
1523,5.4315,8uYj60gf5SU,2,117961,2412924,6946,The Most Terrifying Monster We Can Imagine
1524,5.4335,8sC5YEIp5fI,0,108141,7029133,3479,I Surprised Ronaldo with a Custom Football
1525,5.4354,8rkLfx4Ha3Y,0,1698,125633,139,People Having a *REALLY* Bad Day! (UNLUCKY)
1526,5.4373,8n5Lh_sIN-k,2,19847,361379,765,Do world records even mean anything?
1527,5.4391,8jdNxTRFMec,1,61837,1281412,1688,The American isekai you've never heard of
1528,5.4411,8hqu5iSGhtU,0,1534,161161,183,Weird Nail Art That SHOULD NOT Exist!
1529,5.4606,sw5ZZiMLgwE,0,2751,291040,641,Secret Things I Learned on TikTok
1530,5.4628,nhSo7rf-yEw,1,10527,906401,676,How to Sneak Candy into a Movie Theater!
1531,5.465,gJ4C5BlIEGo,0,8825,585043,615,World’s WEIRDEST Games on Google!
1532,5.4669,d9g7cpS_NoE,0,13417,497765,744,Creative People On Another Level
1533,5.4702,YpLN5oBr9C4,1,7263,714800,1237,Minecraft Inventions That Are UNREAL
1534,5.4721,Tpx4IlgxnsI,1,2895,259248,1007,HARDEST Try Not To Laugh Challenge
1535,5.4741,SaJJhD2D5e8,2,0,2663224,790,⭐ NAIL ART STORYTIME TIKTOK ✨ Regal Nails @Brianna Mizura || POVs Tiktok Compilations 2023 #22
1536,5.4762,P5EaRpFwNXc,0,13862,2427513,1356,💅 NAIL ART STORYTIME TIKTOK 💅 NEW Briana Mizura Idol || POVs Tiktok Compilations 2023 #15
1537,5.4782,NWd7H-AAQwE,0,4352,418254,1479,Kid Has Fear of Food!
1538,5.4801,HS26ye35Rpk,0,1895,132116,198,I Bought the Most CURSED Toys From My Childhood!
1539,5.4821,CepKncl_kYw,0,3107,118878,314,Testing Amazon Slime & Squishy Kits | Slime Reviews
1540,5.4842,8uTJEOhSW2s,0,997,24184,162,I Tried Viral TikTok Hacks!
1541,5.4861,8hKIo4Lmlk0,1,33804,6739191,666,Minecraft but What's this Wither?!
1542,5.4879,8ewFBbyNtgk,1,291761,21562049,10759,I Cooked YouTubers Their Favorite Foods
1543,5.4899,8efjL9wTlAs,0,36038,464050,3065,Cleaning Supplies are Extremely Stupid
1544,5.497,oI4fSxkqdLU,3,34188,458754,3351,Was Nietzsche MAGA?
1545,5.4989,PgpJWPCwLAI,3,138418,2568791,5896,Dungeon Master Brennan Lee Mulligan Answers DnD Questions | Tech Support | WIRED
1546,5.5008,8_62FNVVPxI,0,3408,135270,378,The Deadliest Minecraft Player: Clownpierce
1547,5.503,8WnFKy7Rhf8,11,60355,1411002,2146,Game Theory: You Were MEANT To Die! (Finding Frankie)
1548,5.5048,8Qgvc0uTuKQ,0,4628,124575,133,How Many Farms Can I Build in 100 Days?
1549,5.5066,8Q8XoeTCmTQ,5,53440,957893,4884,I Caught Him With 1TB Of CHlLD PH0RN!
1550,5.5085,8Pga3brliIw,1,1417004,50470555,20520,SKINNY IMPOSTER Mod in Among Us
1551,5.5105,8PbXYWK-SJk,0,22570,4577583,775,Best TikToks of Summer 2024
1552,5.5124,8My041YhE8Y,5,48435,1516802,2100,I Investigated Malware Disguised as Games
1553,5.5144,8Mm4C0SD09s,1,27,834,3,Lightning McQueer takes a piss in his cup [YTP]
1554,5.5163,8LylNx-aHeE,8,28006,865028,1525,Can I 100% Every Smash Bros Game in 2 Weeks?
1555,5.5181,8IlwJRrKYTE,4,15343,553235,1016,Can I 100% Every Luigi's Mansion Game in 100 Hours?
1556,5.5203,8HxPlyraj3U,0,74744,19547042,52734,Minecraft Xbox - North Pole [367]
1557,5.5221,8Fpg0K0_n9Y,0,60729,1236001,2136,They Dared Me to Make a Minecraft Mod...
1558,5.5241,8EK_J9M0Ur0,0,7540,87751,803,We BOUGHT a 5 STAR Trampoline Park!
1559,5.5261,89jvYGjAdrY,0,12844,1206043,755,Minecraft, But You Can Mine Anything!
1560,5.5433,xzuhTTIIVe4,0,3785,138102,138,Reacting to 200 ZOMBIES vs EVERY GOD! (TABS)
1561,5.5454,wWupCjGhOZo,0,32191,1488637,1780,I Found Minecraft’s Rarest Secret Seed…
1562,5.5472,rT46HL9DNzQ,2,5088,392952,224,*NEW* Genius 200 IQ Kid Inventions!
1563,5.5495,la-xfa8Byfw,0,7319,155865,1033,IMPOSSIBLE LEGO builds...
1564,5.5514,bI2Y8ro8Vvk,0,64071,3789550,1496,I Found Illegal Realistic Physics In Minecraft
1565,5.5535,ZMHXrhkMcY0,1,9722,649397,454,World's *FUNNIEST* Minecraft Memes!
1566,5.5556,Oc4NNnKfcAo,1,99285,5962683,2981,I Mined The World's Largest Minecraft Blocks!
1567,5.5576,FOrsL3iqHLA,0,948,17223,96,World's FASTEST Workers!
1568,5.5598,82TqzHvzgZQ,1,25152,535281,791,The Mojang ARG You've Never Heard Of
1569,5.5617,80UxDTQPjZc,0,11184,832421,768,WALL·E  Wonka (a YTP of charlie & the chocolate factory)
1570,5.5635,7yE2uQM5B2Q,1,48963,4506750,3643,I Fooled My Friend with FNAF in Minecraft
1571,5.5655,7y3Au1KiUd8,0,61312,17671935,3144,World's *FUNNIEST* Minecraft Memes
1572,5.5674,7rsj5jxRuH0,3,15414,561651,908,Mario 64 but you lose 1 coin every second. Die at 0.
1573,5.5694,7qO-oOpxT80,0,19058,616076,2449,I Bought Things You Shouldn’t Be Able To Buy
1574,5.5714,7pFyxs5ZbrY,0,1984,51438,100,World's SMALLEST Things in Minecraft
1575,5.5733,7nBigBH1r04,5,29374,1227067,854,These Nerdy Students Took Vegas for Millions
1576,5.5751,7m0_8AxgbDY,0,47216,4860271,1772,How Big Can the Wither Storm Get?
1577,5.5769,7i5mVlQfI0U,0,228811,26799009,7034,Turning Red [YTP] but actually funny
1578,5.5788,7bRGpNVbj5c,1,12687,731154,756,Try NOT To LAUGH (Moana Edition)
1579,5.5808,7__r4FVj-EI,2,1702243,91007730,24986,Octopus vs Underwater Maze
1580,5.5955,tpg3VvoIVfA,1,631274,29489202,11193,Testing The World's Smartest Crow
1581,5.5976,pXDx6DjNLDU,0,1945897,61595233,43576,This Robot Eats Trash #TeamSeas
1582,5.5995,mFP_AjJeP-M,1,290720,14074619,17116,The Insane Biology of: The Octopus
1583,5.6015,VLMWq5nfvlk,0,129888,9790117,5246,How Chocolate Is Made
1584,5.6033,JdFRjsEZrmU,0,1248139,79993032,16003,Acid vs Lava- Testing Liquids That Melt Everything
1585,5.6053,E_2c4AePA6Y,1,139812,5239032,5251,I Banned A Corrupt Admin From His Own Server
1586,5.6072,DYpl9k-VMJw,7,4055,188448,159,Why it sucks to be born as an Oarfish (doomsday fish)
1587,5.6093,9c2NqlUWZfo,4,787193,69491651,13580,World’s Smallest Nerf Gun Shoots an Ant
1588,5.6112,7UrBa4e77Pw,0,25644,2345303,2356,Minecraft's Most Unluckiest Moments ANIMATED
1589,5.6133,7UKNuYc4FMY,1,7219,383206,1615,Weirdest Things You CAN’T UNSEE!
1590,5.6151,7Ti2EKYZ-q8,1,1771,13308,168,Can Your Pants SAVE Your Life? | Style Theory
1591,5.6171,7RxzZ50vBko,1,4202,365172,225,Videos With UNEXPECTED Endings...
1592,5.6191,7RIvq98nXvc,0,226296,22972631,34557,Our Son's BIG Accident
1593,5.6209,7RB3nkFEZiQ,1,40409,8136554,6772,Minecraft Xbox - Hunger Games - Enchanted Kingdom
1594,5.6318,tEz7gBaSAcM,0,59162,9548411,12118,Minecraft Xbox - Nyan Lights - Parkour Race
1595,5.634,TVODCmHgnSk,0,956,39279,54,I Platinum'd EVERY Minecraft Game
1596,5.6359,Ce2P0oCb7PU,0,4378,87795,459,MINECRAFT ADDED WAYPOINTS, BETTER HAPPY GHASTS, + LOCATOR BAR V2 (snapshot 25w15a)
1597,5.6381,9JfWPfn7iZs,0,5805,335927,840,EVERYTHING You Missed in 'A Minecraft Movie'
1598,5.6399,7NWSsgvzkCE,0,13787,1985656,663,Minecraft Villagers SPLIT The Village in HALF
1599,5.6418,7Mvy_Y2j3GE,3,15651,530139,1981,The Illogical Case Behind Buying Greenland
1600,5.6437,78cX0yLJPMw,1,188092,5322028,5792,I bought the Ultimate Survival Tech
1601,5.6457,77VEZj9i0L0,0,725,16969,90,Top 10 Things Only Minecraft Players Noticed In A Minecraft Movie
1602,5.6475,73c6cJA8zOE,0,16124,321321,1067,I opened a candy store
1603,5.6495,72l1LHBUgnI,0,57008,6795991,2626,More (YTP)
1604,5.6515,71QGuljCHwo,0,96623,2583775,3146,Can You Beat Minecraft Spectator Mode?
1605,5.6535,70nHmlapu7w,1,240358,3341526,24547,Where Do We Go From Here?
1606,5.6553,6yK7UhRwCFM,1,1274,88010,155,WORLDS Most VIEWED YouTube Shorts!
1607,5.6571,6w97dXvadgs,0,113064,4501021,7244,I Collected EVERY NEW WOLF in Minecraft Hardcore
1608,5.6589,6slnSNe0nIM,0,93434,3669346,5293,Can You Beat Minecraft's NEW Hardest Mod?
1609,5.6608,6rFGz5AWrjU,0,14116,579786,496,Strange Inventions That ACTUALLY Exist
1610,5.6626,6nfGwSw-I14,1,108714,4095843,4184,Scammer Payback Answers Scam Questions | Tech Support | WIRED
1611,5.6646,6mxTsCxM6fI,0,125315,2146161,10976,Can You Beat Minecraft From ONLY Liquids?
1612,5.6665,6mv8WA51JMg,0,41886,3002925,1519,Trying To Break EVERY Minecraft Block In REAL LIFE!
1613,5.6684,6l4iSo9uyF0,1,25195,668267,1902,Food Theory: ﻿Why is Everyone Going BACK to Chili's?
1614,5.6703,6h2v8ZBhbko,7,93922,2852546,4724,Is This the Drunkest Man in Police History
1615,5.6722,6eqli0ZVhOk,3,10669,227438,1568,i watched the live action snow white movie so you don't have to 🍎💀💋 (snow white review)
1616,5.6741,6dTyOl1fmDo,1,63792,1698290,2004,There's more to those colliding blocks that compute pi
1617,5.6759,6cG9x0vltKY,0,0,92296,61,Turning Red [YTP] | A Turning Red Parody by Bamboo Studio
1618,5.6778,6c94vRmbM6Y,0,11843,161670,1597,Can we power the world with only clean energy?
1619,5.6797,6a8sARDI4VI,6,38900,741077,1848,To Kill The Sacred Worm
1620,5.6815,6_Py9INA4lE,1,57250,9967014,2910,People Having A Bad Day | Funny Fails Compilation
1621,5.6834,6_H2Rfecv4s,0,76187,10647145,8066,IF YOU DON'T LAUGH   I'LL PAY YOU   [YTP Monsters Inc.]
1622,5.6853,6R0tDz8rad4,0,16793,1672256,1597,I Exposed The Worst Rated Cruises!
1623,5.6983,6QCwbSpAHRk,0,72922,9380726,2170,Aphmau's A Fish In A Bottle In I AM FISH!
1624,5.7176,xlP_BYtxp-g,0,6351,540114,586,World’s FUNNIEST Bluey Animations
1625,5.7291,ydXoYx0u5V4,0,5673,686482,447,Creative People on Another Level!
1626,5.7311,xKkqRxCe-Fc,0,36123,4713039,2214,ONE AMAZON on an ALL BOYS Island!
1627,5.7331,taxBMIh5I_A,0,43734,4119539,2743,RUNNING AFTER KIDS TO KEEP THEM SAFE - Think Of The Children!
1628,5.7352,ra2v1HeeI84,1,25428,1387976,1188,MAX IS FISH | I Am Fish
1629,5.7372,oAlGovPyyRw,1,34379,2001674,3406,I Found The Rarest Secret Mobs in Minecraft
1630,5.7391,kXUm-3D1DGE,0,29730,4495732,1883,Aphmau's MERMAID SECRET in Minecraft!
1631,5.7409,k6I-itsrA7s,1,4627,250387,271,Evolving as a CREEPER in Minecraft
1632,5.7429,ilrgoWGTg2Q,0,37884,4255355,1135,Our NECKS Keep GROWING In Roblox!
1633,5.7448,hMMqWYTrvgg,3,77035,5506878,2546,I Found A CORGI PUPPY In Minecraft!
1634,5.7469,ggP8Ki733rQ,0,53913,6700701,1952,Escaping DETENTION in Roblox!
1635,5.7501,f4Re_WpFrIw,1,1656,137427,255,The FUNNIEST Bluey Ripoffs Of All Time!
1636,5.752,_gsp_ogAmNs,0,10037,1034969,835,Preston is Missing! *Game of Clue*
1637,5.754,XJqFUFZ443Y,1,2786,137084,201,He Adopted a Pet Black Widow
1638,5.7558,RHnKQnbTZa4,0,155207,19251465,3354,This Tiny Girl STOLE My Stuff!
1639,5.7578,LscDAOCaVsw,0,72672,5929658,1726,How I Got Caught By A VAMPIRE! | TAKELINGS HOUSE PARTY
1640,5.7603,Ao8TEjjSrsI,4,8776,674688,538,My Pet is DYING…
1641,5.7623,9jei3MwNL2Q,0,84420,6851811,3059,Aphmau Is IMPOSSIBLE To Get Along With In Untitled Goose Game!
1642,5.7643,6NB-PdZzeLU,0,15904,336738,1995,NEW Gameplay Revealed in Mario Kart World (INSANE Techniques)
1643,5.7662,6LUShb3e7CA,16,54670,5148012,5732,Hunting My Little Brother's Killer
1644,5.7681,6KJEIVyy40g,0,40731,1223141,3445,How a Minecraft Theory Drove Him Insane
1645,5.7854,usm94O6QXOU,6,43302,673212,1910,Can you beat Minecraft with every horror mod installed?
1646,5.7873,qs_cDzB8ujY,4,103590,2883227,3960,The Creepy Mystery of construct_13_beta
1647,5.7894,fAfUNbC06D4,0,8486,142221,798,Is He Back??? (Minecraft Theory)
1648,5.7913,WpfJnuiRM5k,2,33544,1078845,2484,I Simulated The Truman Show in Minecraft
1649,5.7933,T6clGMmtBiU,10,50672,1952423,5385,The Minecraft Player Trapped In A Simulation
1650,5.7952,O0XU76RAwJ8,12,14445,508912,755,The Player Trapped In A Timeloop - The Decayed [FULL MOVIE]
1651,5.7972,KySMLhQpDEU,1,4368,101443,375,The Minecraft Horror Iceberg Explained
1652,5.7992,JBJVYfbzjiU,59,4684,97857,160,this is how you kill 100% of a town...
1653,5.8013,FKRFBgQeBGs,1,84545,2720891,3011,Found Footage of a Player Being Followed
1654,5.8032,6HiJNdM0SNQ,0,1948,1624982,209,Sneaky Jokes on April Fools Day! (We Turned Dad Green!)
1655,5.8052,6Ex007JxiOQ,0,19970,592145,560,Reacting to 200 ZOMBIES vs the GODS!
1656,5.8071,67Yw_lux9O4,3,65638,1074010,5029,I Gaslit Far-Right Twitter Into Being Woke
1657,5.8091,6761eHcUf0U,4,9966,1932269,637,Oddly Satisfying Videos To Fall Asleep To!
1658,5.8109,638SUAulNlk,1,7122,201686,283,Letting Humanity Progress Until They Make GIANT ROBOTS
1659,5.813,61PVs2N61H0,0,1698901,47014163,75895,I Must Win MrBeast's $10,000 Refrigerator
1660,5.8148,5zQ0WewZY50,8,139272,5127043,10314,Trump & Tariffs: Last Week Tonight with John Oliver (HBO)
1661,5.8167,5z2lPpj3OTQ,6,45332,1958927,1417,Kid Cuisine Taste Test Tournament
1662,5.8266,jNr-VoldcTs,8,42676,1586685,1343,Rhett vs. Link Cooking Challenge
1663,5.8286,e5R4PNfPVwk,1,99462,5452585,3830,Lunchables Taste Test Tournament
1664,5.8306,MvUVAP6ZxMk,1,55434,2738102,1874,Trying Weird Water Flavors We Saw On TikTok
1665,5.8325,CcVsJZNPHew,3,33828,1673007,943,What's The Best Costco Snack? Taste Test
1666,5.8344,5xjLGGUVgZ0,0,18231,829048,1743,$1 LAPTOP Vs Minecraft...
1667,5.8362,5xWJ2Q_hiys,7,38633,1213628,2238,Giving Away The Strongest Weapon In Minecraft
1668,5.8381,5w9fSzdZNu0,0,14962,537768,485,memes but if you laugh you Tom Holland
1669,5.8401,5tRLFSmjvj0,3,20090,608578,526,The HORRORS of JARS DRAWINGS
1670,5.842,5qjwEigkzt0,1,3265,41861,345,Why This YouTuber Risked His Entire Channel
1671,5.8439,5pjOGBNWzkc,1,12736,311416,491,Create Mod Tank Build Battle!
1672,5.8457,5nryM-MdVhU,12,76989,2684973,3835,I Tested Suspicious Phone App Malware (again)
1673,5.8476,5gjdlWg49eg,0,771,20924,102,A Complete Guide to Modern Mace PvP
1674,5.8495,5csvkVi39VI,2,100493,16033800,8151,Eating GIANT vs TINY Food Challenge!
1675,5.8515,5cfbKEK5gzU,1,533223,8791688,44186,My Most UNHINGED Video [Amanda The Adventurer 2]
1676,5.8534,5bevi_0v6wU,1,269581,20438148,14933,I Cooked Against Robots
1677,5.8679,xnpQCHJzhHM,0,98291,11502312,2021,Minecraft but You Can TRADE Anything!
1678,5.8698,jac53THxO0I,2,486937,20280172,19896,I Tested Restaurants with No Reviews
1679,5.8718,hkVChCapfxI,0,53310,3940373,1394,$1 vs $10,000 Illegal Bases in Minecraft!
1680,5.8737,gynd5ZIzBjU,1,27908,5636506,735,Engineer vs Pro Chef- Extreme Gingerbread House Contest
1681,5.8756,a77xo2ktcjw,4,114336,6973397,2462,Touring The Largest Japanese Fish Market
1682,5.8775,Vl3swga-Xrk,0,3029158,190779411,71579,Would You Rather Have A Giant Diamond or $100,000?
1683,5.8796,Twn_4AW0M6U,1,416571,41721354,14316,My Rock, Paper, Scissors Robot Never Loses (+9 Other Inventions)
1684,5.8815,5XQC1dtFH78,0,8446,145478,422,Transforming Stampy's Lovely Minecraft World
1685,5.8834,5PCqQbLquHA,0,43455,891179,12672,Trump GOES FULL PSYCHO in DISASTER Fox Interview
1686,5.8854,5NuhIvcXdMY,0,190052,4614566,10773,My Dog was a MENACE to Society
1687,5.8873,5N6E2cF-CGw,2,126653,28606344,28815,Minecraft Xbox - School Day [244]
1688,5.8891,5J7Ey7PJeaM,8,41400,1238132,1760,Stevie Tries Jollibee For The First Time
1689,5.891,5Fg9oZk-5uA,0,5603719,187277182,188515,I Bought Everything In 5 Stores
1690,5.8929,5EiMD3qrRMI,0,9497,357772,413,when life just hates you
1691,5.8948,5DoNzLhXq8A,0,113392,2581355,5601,Food Theory: McDonald’s SECRET Plot to Kill Starbucks! (CosMc’s)
1692,5.8966,5AytuEJ00Js,0,17261,706438,613,willy wonka being willy wonka for 7 minutes & 16 seconds
1693,5.8984,5A3RWqk31FY,0,7664,1122151,769,Funny Cartoon Logic That Makes NO SENSE!
1694,5.9003,59fg4KiGmNI,0,541487,24853906,9034,Minecraft in Real Life if Ores Were SUPER!
1695,5.9022,56EyKNjhUDY,6,301130,5792925,16641,Everybody wants to waste your time
1696,5.9042,51bF3tzEkLQ,0,469323,33372416,59420,My Pyromaniac Brother
1697,5.9062,4yYjeNxlu6U,0,40702,8700991,5385,Minecraft Xbox - Bubble Panic - Hunger Games W/IBallistic Squid
1698,5.914,oFRem2oUNYI,0,48518,4284222,4284,GIRL BULLIED At School For Her MUSCLES | Dhar Mann Studios
1699,5.9159,bgyrWLwvbug,0,502752,35565435,80323,Minecraft: TSUNAMIS!!! (DISASTERS THAT DESTROY THE WORLD!) Mod Showcase
1700,5.918,PUaBbDXCCxM,0,19320,3131409,3124,Minecraft Xbox - Island Of Eden - Iron Pig Island! [1]
1701,5.9198,4sxjmrkI_oI,0,43591,6198155,1750,Trying Stunts From Sonic The Hedgehog 3 In Real Life!
1702,5.9216,4ofbODSgHRk,0,4788,107471,196,What Are Mystery Scoop TikToks?
1703,5.9235,4mB-4SVGkn0,1,38780,2749718,4012,Insane Things Mojang REJECTED In Minecraft
1704,5.9253,4fvcPDyIlIA,2,15768,1779156,1574,Minecraft Items in REAL LIFE! (Animals, Items, Blocks)
1705,5.9272,4dDUWRWqcIo,2,1009756,36648353,19655,The Ultimate “How To Train Your Dragon” Recap Cartoon
1706,5.9459,xSV781U0KjE,1,150670,15119300,1296,EPIC SHREK ANIMATION COMPILATION
1707,5.9478,pXCpc2Bcirs,0,796806,42533396,0,HOW TO TRAIN YOUR DRAGON: THE HIDDEN WORLD | Kit Harington and Toothless’ Lost Audition Tapes
1708,5.9497,o-UwaetV5EM,2,167061,5256127,6796,The Ultimate “Pokemon” Recap Cartoon
1709,5.9515,nzGQ91_gn0Y,2,7002,1673139,292,you laugh, you win
1710,5.9534,m5LjA0gjeX8,3,154627,4197585,3875,Ghost Stories Dub Funny Moments
1711,5.9553,VXJmSBEwk0k,0,229007,8161810,4868,The Ultimate "Harry Potter and the Philosopher's Stone" Recap Cartoon
1712,5.9572,QSMDb1CWD6Y,1,37178,508216,2449,I Spent 30 Days in a Dead Game
1713,5.9591,I5cFBi02O34,1,634948,10166188,15376,THE LEGEND OF PIPI - ANIMATED SHORTFILM
1714,5.961,EJXeO-H-zEk,0,194252,8466795,2857,The Ultimate "Ice Age" Recap Cartoon
1715,5.9629,C1hExNT9KpQ,0,570189,21455094,13225,The Ultimate “Five Nights at Freddy's” Recap Cartoon
1716,5.9647,8y9QnS_tMkY,0,807218,32240064,17099,The Ultimate "Kung Fu Panda" Recap Cartoon
1717,5.9668,8CCk4s09AEM,0,80815,2212760,3851,The Ultimate "Super Mario Galaxy" Recap Cartoon
1718,5.9686,5T5vA6_K5V0,0,163851,16442675,1494,PIXAR TOP 5 Ultimate Recap Cartoons
1719,5.9705,4c-28TeEAkM,0,70,15158,0,Which mob is the most immortal against spikes?
1720,5.9723,4UItmh_39uw,1,9795,275425,1595,Minecraft - Frosty 'Longer' Nose [685]
1721,5.9742,4OCHLy5rP58,3,748589,37680841,32115,the entire history of minecraft, i guess
1722,5.9761,4JyJCTNUEAc,1,38225,2017381,5087,I Got Hunted by Minecraft Bounty Hunters
1723,5.978,4I98SqgIETM,1,48500,2461503,951,How Many Courses Can You Drive Backwards In Mario Kart 8 Deluxe?
1724,5.9922,nGgpNjxYOiA,0,9920,331157,327,What If Minecraft Looked Like A Cartoon?
1725,5.9942,Sf2CGwJISSw,0,18587,1136768,686,Can You Win A Race in A Straight Line?
1726,5.9962,PWLlMlGyrg4,0,7412,204687,236,The Quest To Collect Every Coin In Mario Kart 8 Deluxe
1727,5.9982,OQo5QURSxUc,0,7443,733688,229,Reacting to Every World Record in Mario Kart Wii... with Ultra Shortcuts
1728,5.9999,OHNyXOAxRo8,0,9778,332834,337,How Many Tracks Can You Beat Entirely In Offroad?
1729,6.0019,Nn_L0B9B6UM,0,36849,1183012,781,How Many Courses Can You Drift Infinitely On In Mario Kart 8 Deluxe?
1730,6.0037,FywVt7V8xik,0,13490,1013658,750,I made EVERY Track Harder in Mario Kart
1731,6.0057,9dOrsJ2rR38,0,7421,296966,430,Can you WIN a Mario Kart race with RANDOM inputs?
1732,6.0075,6knAoUvaIRw,1,13370,378974,374,Can You Trigger Lakitu In A Battle In Mario Kart 8 Deluxe?
1733,6.0095,6g17cJ1FYcw,2,52625,2694200,1504,Smash But Jumps Heights Are Canon
1734,6.0113,4HHSzM8PHwY,2,20045,2245576,1112,World’s HARDEST Try Not To Laugh Challenge!
1735,6.0131,4FxukrxCxUw,0,58823,4685856,1431,Breaking 200 Minecraft Laws In 24 Hours
1736,6.0151,4BwHMnt_x04,0,40730,10906838,11367,Minecraft Xbox - Halloween Hunger Games - Bone Yard
1737,6.0201,UXNEW7jOSsY,2,27889,913922,1913,Turning Into Phase 4 SSundee in Among Us
1738,6.0235,4BoOgQ841mA,1,2352,5254,205,Drag Queens Trixie Mattel & Katya React to The Residence Season 1 | I Like to Watch | Netflix
1739,6.0255,4AzEHjyztac,11,99,3959,77,Playing Minecraft for the first time in 6 YEARS
1740,6.0273,48h57PspBec,0,7862337,451350968,158603,$1 vs $1,000,000,000 Yacht!
1741,6.0293,46XaJvIxPeY,5,26269,372576,3172,Trump Hates Science
1742,6.038,vU86d0k71-w,0,1913,51805,748,SCOTUS Chief Justice John Roberts Publicly SCOLDS Trump
1743,6.0398,ol4X6oc-tz8,12,38957,591584,5497,Elon and Zuck are INSECURE Men
1744,6.0418,ochgnYc4hXg,2,85211,1195617,10893,The Tesla protests are working.
1745,6.0436,Br6ssY-OrTc,3,18424,197555,2476,‘I WAS WRONG!’: MAGA Voter WAKES UP About Trump’s Fascist Cult | The Kyle Kulinski Show
1746,6.0456,45wzHeCFmS8,0,10774,1024450,626,I Survived 100 Days as TRAIN EATER in Minecraft
1747,6.0476,44Zr3z216ow,1,66436,856706,2986,ai reacting to ai
1748,6.0495,44FwTJ0o2HU,0,10872,231838,769,Where Are Minecraft's Dimensions Located?
1749,6.0512,43-syKV_XaU,0,452,276827,150,I Became a CAT and Learned Kitty SECRETS!
1750,6.0531,42ymRPVKdUA,8,31468,496541,2046,What if the Universe was a Big Experiment? | Rhett and Link Ask Hank Anything
1751,6.055,41tkMAUJr8k,2,718099,106431097,26762,Eating 100 Years of School Lunches!
1752,6.0568,3yTQbWDGQsU,0,82800,7398346,2379,CRAZY Animals Escape MY ZOO!
1753,6.0587,3yLoHdK3Xoc,0,59348,12283565,10923,Minecraft Xbox - Mario Universe Hunger Games
1754,6.067,bY9mm_nanFg,1,124845,10830754,15524,Minecraft: *INSANE* PLURAL LUCKY BLOCK BEDWARS! - Modded Mini-Game
1755,6.0689,a6Xbsn1y9LA,1,277036,25625454,50808,Minecraft: BOB FAMILY CHALLENGE GAMES - Lucky Block Mod - Modded Mini-Game
1756,6.0707,3y7FBN-NuAc,1,201297,4847503,12142,Dream ABSOLUTELY DESTROYS Claims that his Manhunts Are FAKE
1757,6.0726,3uY8EPdzCYg,0,13190,476637,364,I Remade Blocks into Mobs in Minecraft
1758,6.0744,3pvkgUc9Zbc,1,14556,302480,4023,Are Dating Apps Really Stacked Against Men?
1759,6.0762,3olsPmfbkVU,2,387867,13196187,11748,Weirdest NAIL ART that should NOT Exist
1760,6.078,3lar1hvS-TU,1,16943,2393725,3086,ELEVATION ACCELERATION - Custom Puzzle Map! W/Stamps
1761,6.0842,U9upz_M5nZ4,1,7414,886206,774,KEEP TALKING AND NOBODY EXPLODES! W/AshDubh
1762,6.0859,3isfPdsWaMc,3,235894,10525914,12252,Meanest VS Nicest Celebrities
1763,6.088,3gLNA3y69PU,5,7977,95127,976,Can I Fix My $2000 Mistake? - The HP DV9000 From 2008 (My First Laptop and The WORST HP Ever Made)
1764,6.0898,3g-qml3fIio,0,66578,4178894,17198,Sneaking Into ALL BOYS SCHOOL
1765,6.0916,3dBEz3kwzi0,1,249438,15481207,21086,I Tested 1-Star Theme Parks (again)
1766,6.0935,3c6EyKUHvX8,0,29073,2525395,3578,I Found EYstreem’s Secret Minecraft USB…
1767,6.0953,3bFb9-Z-m0c,0,75433,6875703,6280,World’s Most Satisfying Videos!
1768,6.0971,3aYpG8kn4nc,0,51524,787329,1631,How a Forest Digests You
1769,6.0989,3XD0z3XmmQQ,0,59578,1398343,2303,We Need to Beat Minecraft in 15 Minutes
1770,6.1007,3WIaCp09Yz0,2,6454,205597,251,What's The Best Seat In Every Room?
1771,6.1025,3To5DZ65n0U,27,6787,132359,1524,When Gooning Ruins Your Life.
1772,6.1044,3RsCAVqyHSI,4,5575,187577,736,The Banned Minecraft Mod I NEVER Should Have Tried...
1773,6.1062,3R2e-HkQ37M,0,124503,26805446,0,Try Not to LAUGH while watching Kids fails Videos - Funniest Home Videos
1774,6.1225,e7vIGVJMqcU,0,148791,38633596,2759,Try Not To Laugh - Funniest Rides | Fails of the Week
1775,6.1245,aP_JRC5zqAg,0,25949,11112859,324,Funny Videos Compilation 🤣 Pranks - Amazing Stunts - By Happy Channel #1
1776,6.1262,PAORQoMvSdY,0,1670,359182,38,Funniest Cats and Dogs Clip 2025😼🐶Try Not To Laugh😜
