order,timestamp_ms,video_id,flag_count,like_count,view_count,comment_count,title
614,2.3831,gruLrLkpmFo,0,2611,314724,33,All Mutant Mobs Generate Sculk Minecraft
615,2.3852,gD3Wl7BUrF4,4,10255,619944,275,What Happens If CURSED Sculk Crashes Into Villagers?
616,2.3872,W7h3PtSG1zg,1,424162,31038534,17573,I Found Minecraft's Rarest Items
617,2.3893,T-PqV4cF-f8,5,105472,5413457,829,a mod with mobs you've never seen before 2
618,2.3913,KxN4BlFMsDE,1,6544,171281,1077,Minecraft - Chain Reaction [755]
619,2.3934,Kvzg9rYX1bE,2,37164,3472401,1715,Try not to Laugh Meme Challenge [1]
620,2.3954,KvIl8mjMTsE,0,1185160,103008847,20899,Extreme Try Not To Laugh Challenge!
621,2.3973,KskeGIia2Yg,1,240861,20949315,9026,Destroy The Unbreakable Car, Win $1,000!
622,2.3994,KrLj6nc516A,0,7438915,412545300,150369,$1 vs $100,000,000 Car!
623,2.4013,KgqGt5zLUsY,0,689424,32116850,30904,Minecraft But Mining Diamonds Multiplies Health!
624,2.4202,wZWdGZER-_I,1,33268,3284056,1447,Escaping Maximum Security PRISON!
625,2.4222,u7kfjOtZDyA,1,53770,5440534,4095,I OPENED a SHOP in Minecraft…
626,2.4243,lklzNxMtXp8,0,584096,41622309,11263,BUSTING 100 Minecraft Myths in Real Life!
627,2.4262,jDiEqO3hFUA,0,277327,26116413,4419,Minecraft But Everything I Touch Turns To...
628,2.4282,h4mN3l0R-9c,0,54972,6383336,2137,Minecraft But Your Hearts = Your Strength
629,2.4302,O9lzQDRt3HY,0,55903,6370346,2689,How Minecraft Mobs Act when you leave…
630,2.4322,MUITFNG-Wps,0,411430,20753361,12177,I Survived 200 Days in Minecraft PRISON! *max security*
631,2.4343,MR9q4IQhyyE,0,346332,24291238,10179,Minecraft But You Can Mine Anything
632,2.4363,KgsSFYU14Es,0,7576,375589,626,Minecraft, But With Too Much Realism...
633,2.4381,KcgpSZa-vUk,1,32530,3180818,1334,Rayan
634,2.44,Kbv20kD95NY,2,24852,2223360,2070,All Your Fears In One Video!
635,2.442,KbNJ6uodEyg,0,2093,93839,219,Ryan’s World Is Finally Coming To An End…
636,2.4439,KaiHdIKfSpk,1,370112,18241130,16357,Exploring the Creepiest Google Maps Locations!
637,2.4616,mu8E5SngnzQ,0,1352,168317,23,He Finds A Strange Cube That Opens A Portal To The Minecraft World
638,2.4638,ktsccJZWunM,6,514753,33799740,15416,I STAYED AT 100 OF THE WEIRDEST HOTELS!
639,2.4658,fuhE6PYnRMc,0,6455547,257679067,129760,Train Vs Giant Pit
640,2.4677,dRrTj0x8Td4,0,614702,67403303,15107,I Built a SECRET Lamborghini Dealership!
641,2.4697,_KkVtCHBzUs,1,11497,2661624,1109,World's Craziest Things Spotted on Google Maps!
642,2.4717,Xqmr1k4Mz0I,0,8481,924737,823,Scariest things found on Google maps
643,2.4737,RI90w4gRPug,3,1037500,67532580,24745,I Exposed the World’s Most EVIL 10 Year Old!
644,2.4757,K_CbgLpvH9E,1,5075013,216614100,79052,I Spent 7 Days In Solitary Confinement
645,2.4777,KXOJy6VZueQ,1,5467,708253,254,*NEW* Secrets I Learned On TikTok!
646,2.4946,sv03UMGqjJc,0,3936,80189,1136,NERD Gets REVENGE On BULLIES..
647,2.4965,ilvh7PShS9c,1,407809,49457179,28386,My Daughter Survives WORLD'S STRICTEST PARENTS
648,2.4985,f1Pga6zGr-Q,2,10455,690886,397,*NEW* World's MOST Viewed YouTube Shorts! (Viral Videos)
649,2.5005,YscI8g6EjNY,0,5075,183197,732,BULLETPROOF PYRAMID vs World's Strongest Man!
650,2.5026,Wdr7dVkvsXg,0,2010,102499,168,Science Experiments That Are Actually MAGIC!
651,2.5046,SPfiRr2JF6s,2,79593,8527531,6352,World’s *MOST* Satisfying Videos! (INCREDIBLE)
652,2.5065,KQtZdEZFJmw,0,112748,18933025,16261,Minecraft Xbox - The Dropper - Part 1
653,2.5141,UsZHQjCiKIA,0,33301,5122458,5660,Minecraft Xbox - The Final Contestant - Part 1
654,2.5362,oGnJlFpt82g,0,16388,1865379,757,I BECAME The WORLDS WORST STUDENT (expelled)
655,2.5383,jGNgh5zEFkY,0,208031,3955191,7074,Minecraft LIVE - March 2025
656,2.5404,gg9yJPIHJTY,0,33561,6984297,5495,Minecraft Xbox - The Omega Colony - Part 1
657,2.5424,dwDamDMso2Y,0,40458,1630116,8508,Trump's Press Secretary Drops BOMBSHELL Receipts on Gov't INSANE Spending
658,2.5444,_aVhWhK7PfM,0,166533,14330100,14339,So I Gave 100 Players Creative Mode to Build Secret Houses... - Minecraft
659,2.5464,UXBb0VKvQlY,0,9419,277980,1041,Minecraft - Flower Power 2 [822]
660,2.5484,SpsxRXofIJM,0,29204,5299594,3747,Minecraft Xbox - Prison Escape - Stormwater - Part 1
661,2.5503,S68M4KX_6w8,0,20724,5996160,2054,Minecraft Xbox - Toy Story Adventure Map - Andy's Room [1]
662,2.5692,yZQGc2S-RKY,0,10191,3596844,1264,Minecraft Xbox - Toy Story Adventure Map - Lost Sheep! [2]
663,2.5712,ps3Wyw7Pd2Q,3,29427,6495392,3385,Minecraft Xbox - Hunger Games - Cruise Ship - With Mr.StampyCat
664,2.5802,zZcXdcIPlyU,0,14649,4917349,1853,Minecraft Xbox - Hunger Games - ToyBox - Flower Power
665,2.595,xPEV1XTy_uk,2,12548,3037719,1414,Minecraft Xbox - Wool Race - Part 1
666,2.5971,mmL4kosieGs,1,72984,1477882,5682,Finding A Player Who Doesn't Exist
667,2.6233,ul-vKdeNI_0,15,16019,315004,1288,This Disturbing Minecraft Mod is Borderline Malware
668,2.6253,lnArLTmJa6w,2,92781,2700804,5413,The Wifies Debunk
669,2.6273,kyzdN_TRktQ,0,31730,7373727,5504,Minecraft Xbox - Medieval Christmas - Hunger Games
670,2.6432,z19xWQEBxRU,0,30162,7480633,5393,Minecraft Xbox - Towers - New PVP Game
671,2.6453,sWnszL8kFc0,1,37017,2846293,8357,Minecraft: SANTA'S SLEIGH CRASHED!! - The Crash Before Christmas - Custom Map
672,2.6473,njt3DeAFNn4,0,22524,5452029,2703,Minecraft Xbox - Broken Home Tree - Hunger Games
673,2.6494,j04IAbWCszg,0,17046,155300,2689,Explaining the Trump Tariff Equation
674,2.6514,hUH64syJyJU,0,12500,1529375,1849,Minecraft - DIMENSION JUMPER! W/AshDubh - Part [1]
675,2.6533,hEJkLX9oXhQ,2,97778,2213955,3635,I Made a Water Park with a 0% Survival Rate - Planet Coaster 2
676,2.6556,gftiSmaA-Nk,1,33276,6475090,7644,Minecraft Xbox - Randoms Adventure Map - Part 3
677,2.6577,eog1iZO9TLU,1,9313,185678,405,This Server Is Hiding A Cult
678,2.7027,tglkEdpHu3o,3,8206,239551,457,The STRANGEST Minecraft ARG Ever Uncovered
679,2.7048,ok-TuqzHZ2U,3,4592,107063,256,The Minecraft ARG Where You Go Back in Time and Change EVERYTHING
680,2.7069,g5zkr72gVJ8,66,14129,261584,778,I 100%'d Schedule 1. It Was Absurd.
681,2.709,eIMkPrgqWuA,4,23494,620358,1247,STRUCTURE.ZIP: The Mystery of a Player Being Tortured
682,2.7111,dwaXp-Rnf7I,0,324810,2565784,39527,Parkour Horror GAME SHOW!? [Finding Frankie]
683,2.7132,dDkNabeB8p8,4,4189,116301,384,Rey Rivera: The Man Who Fell Out of The Sky
684,2.7152,ccVLD8Lh0BQ,0,20655,2923446,3594,Minecraft Xbox - Woodland Realm - Hunger Games
685,2.7358,mlnAYza-V0c,0,37710,2783527,2541,I Found The Rarest Secret Rooms In Minecraft
686,2.7378,j3WfxOs3hHA,11,1302,34508,165,The Ultimate Minecraft Iceberg Explained
687,2.7397,isa8ZDeqrds,0,495,6787,48,Nintendo Actually Roasted Their Own Games
688,2.7417,brZQBdaeHlI,1,26535,722991,1264,Disturbing Footage of a Player Being Hunted
689,2.7439,bn0ZiPVyEm0,0,44219,2700803,1078,$1 Every Block You Break!
690,2.7459,bGc4HdlftPk,0,96599,7321776,20688,Minecraft: - ULTIMATE DROPPER!!! - THE DROPPER - Custom Map [1]
691,2.7479,aPcnKqpB2mQ,1,56692,11118757,8535,Minecraft Xbox - Cookie Kingdom - Survival Games
692,2.7498,_cr46G2K5Fo,0,143838,4692951,11900,The Man Who Almost Broke Math (And Himself...)
693,2.7518,ZeLe1Ad47P4,0,18946,4736837,2419,Minecraft Xbox - Hunger Games - Bubble Panic
694,2.7671,wynHYM7KAac,0,33271,837008,2597,Why Catching this Pokémon was Almost Impossible
695,2.7691,wiLzhVJEBME,0,48714,631505,1851,Hermitcraft 10: Episode 32: WELCOME HOME!
696,2.7725,sIzFT4hAKGw,2,21429,307080,3279,I Released FROGS Into My Giant Rainforest Vivariums - 'The Age of the Frogs'
697,2.7746,oHjYH9QLMfA,2,6956,1851875,756,Minecraft Xbox - The Tree Of Life - Boat Parkour [2]
698,2.7766,ZFIDK2E3-00,0,948,38300,238,Minecraft-Stampy’s lovely world secret locations
699,2.7787,YISnxMg1nNM,1,76294,1962206,7042,The Minecraft Mod That Hunts You Down
700,2.7933,vjKwaLwX8Yo,0,159141,4605492,6817,Disturbing Minecraft Alpha Footage You've Never Seen
701,2.7954,vK7_UvzKFC4,0,60855,2616659,2014,Solving Minecraft's Biggest Mystery
702,2.7973,mmRr6Pb3Z04,1,60818,1248848,3726,The (Not Very) Scary Minecraft Horror Mods
703,2.7993,jtqXrhX8_DU,1,95447,2991136,5698,Horrifying Discoveries in Minecraft Beta Footage
704,2.8014,apBiDQHUDfo,1,8398,255139,244,The Mystery Behind The "ClaytonM634" Minecraft ARG
705,2.8036,Xo9LFEfX8ro,2,8199,1257838,367,Minecraft but there are Too Many Diamonds
706,2.8055,XLIP1BNAYaY,2,36452,924541,4923,"Mario Kart World Looks BAD"
707,2.8075,WespgznFr2Q,0,3326,851075,131,Hilarious Pet Moments | 1 Hour of FUNNY Animals
708,2.8094,WeF8fnRA_10,0,30662,5923988,5265,Minecraft Xbox - Forgotten Mines - Hunger Games
709,2.824,z2a16rMoqJY,6,119096,2861602,2541,I Built a Functional Dam in Minecraft!
710,2.8259,fIaUicQod2g,1,58865,12215196,13345,Minecraft Xbox - World Of Seuss - Hunger Games
711,2.828,Z8en_A09EDg,0,163600,16193564,20400,A Terrifying Night We’ll NEVER Forget
712,2.83,VwEbWjzC9a4,0,4186,111638,249,The Seed That Erased A Player from Minecraft Forever
713,2.8322,Vvf6GS5Fs3Q,2,38636,939005,2001,Exploring the Horrors of the Minecraft Community
714,2.8342,Vg52f4RNmPA,0,32345,7328794,4700,Minecraft Xbox - Candy Land Hunger Games
715,2.8362,VfoHzDjhfFM,2,27314,621364,1576,Minecraft, But The Whole World Is Underwater
716,2.8383,VEle3pZRqmI,1,140583,5995584,10583,Trump Tariff Cold Open - SNL
717,2.8403,T4dhIMVtPVE,0,47639,9943121,10531,Minecraft Xbox - 4J Studios Lounge - Hunger Games
718,2.8509,sSk8ltE6Nts,9,141946,6184411,4074,How I Made $3,262,221,056 Ruining the Real Estate Market - Estate Agent Simulator
719,2.8529,khqe2J7HLBU,0,30923,5905037,5672,Minecraft Xbox One - Egypt Hunger Games
720,2.8665,pa-G3-N4Rx0,0,61920,6326095,13236,Minecraft: KING KONG CHALLENGE GAMES - Lucky Block Mod - Modded Mini-Game
721,2.8684,mXl5ASx75_o,1,2537,157216,357,The HARDEST Part in Every Zelda Game
722,2.8704,ZWnfgPIc35o,0,12215,187579,651,Let's Figure Out Redstone Fans!
723,2.8724,YJt2E33zEL4,1,21319,375151,1290,We Survived -20 Degrees! | Winter Survival Games
724,2.8745,YDTXa1WIT5Q,3,17344,1022189,765,SNL Weekend Update Trump 4/5/25 |Saturday Night Live April 5, 2025
725,2.8766,X74MRO70kMg,0,64640,11708871,14852,Minecraft Xbox - Christmas Wonderland - Hunger Games
726,2.8864,qRRfksZxLyc,3,297080,18404269,10026,Tasting Food From Every Decade
727,2.907,zKIFUMj0zgo,2,64944,3020297,2374,We Tried EVERY Instant Ramen
728,2.9096,pfIWxFIVP_Y,1,100739,5536821,3593,Why The Olympics Almost Banned This Shoe
729,2.9123,md75n8cyenA,2,714566,40673731,14207,How to Escape a Police Sniffing Dog
730,2.9146,lv6R9TexjCQ,1,60112,8240267,613,Engineers vs Extreme Hide & Seek
731,2.9166,iWT0kl1k32M,0,249707,10953643,44359,I Tried Food From Every State In America
732,2.9186,hFZFjoX2cGg,2,2735171,135702287,93355,Backyard Squirrel Maze 1.0- Ninja Warrior Course
733,2.9212,h0HjktaeEpA,2,338129,27917243,17367,I Tested 1-Star Kitchen Gadgets
734,2.9317,zpTOtt9gOE8,0,238265,11056521,8790,I Trained A Rat To Cook Ratatouille
735,2.9338,kU2pSzKkfOk,0,483675,26030650,23257,I Asked 100 Drive Thrus for Banned Items
736,2.9358,eiQZ0yDKnnA,1,13278,1256370,702,I Turned my Bunk Bed into a Race Car!
737,2.9379,eeyJt_bXxhA,0,57182,4355753,3913,How Japan is Destroying American Fast Food!!
738,2.9399,cZypFRdPS9M,4,131255,4117884,6180,I bought the Cheapest Tech on the internet.
739,2.9419,biYDckvtLYk,0,2974,1060033,38,TRY NOT TO LAUGH 🤣🤣 Best Funny Videos compilation 2025 - Fails & Hilarious Moments😂
740,2.9636,mOYSPMpG6Tc,0,18,747,14,Funny & Hilarious People Life 😆 #1154 | TRY NOT TO LAUGH IMPOSSIBLE 😂😁😆 Best Funny Videos 2025
741,2.9654,gEqosdQU7rc,1,75,16838,2,YOU LAUGH YOU LOSE 🤣The funniest videos of 2025- Failures & Funny Moments that won't disappoint you😂
742,2.9675,fY8TU7uSHdE,0,9,1744,0,YOU LAUGH YOU LOSE 🤣The funniest videos of 2025- Failures & Funny Moments that won't disappoint you😂
743,2.9695,con6SoYNTA4,0,53,23505,0,TRY NOT TO LAUGH 🤣🤣 Best Funny Videos compilation 2025 - Fails & Hilarious Moments😂#3
744,2.9716,cOwD6H9-RnE,0,3201,532826,60,Idiots Around the World | Idiots of the Week | 100% Morons 😂 | Try Not To Laugh | PART 74 #fails
745,2.9736,bjXAj4CC4PI,0,19063,2042959,1110,Year of the Fails | How 2025 is Going So Far
746,2.9757,aw0_klOuTDg,2,235278,18562179,9880,I Ate The World’s Rarest Foods
747,2.9776,_ETSUKIH_Kk,0,210,17983,41,Funny & Hilarious People Life 😆 #6 | Try Not To Laugh 😂 | Instant Regret Fails Compilation 2025
748,2.9794,Ye-VZFF0qLE,0,494360,21889448,43631,I Tried Every Seat on the Most Expensive Train
749,2.9813,YH89a5kUIBo,0,636,104188,12,Best Satisfying Videos - Amazing  Peoples And Tools - LIKE A BOSS! #162
750,2.9834,YFUGXoSxxUQ,0,14234,2897792,559,When Things Go From Bad to WORSE! 😭 Funniest Fail Videos
751,2.9854,Xr92WyxZrEU,0,536,141385,18,New Best Funny Videos of 2024 😅 Try Not To Laugh Challenge Compilation Part #1
752,2.9874,Xo1Ur6izIrE,0,1509,145089,53,Hilarious People Life 😂 #42 | Instant Regret Fails Compilation 2024 - Try Not To Laugh
753,2.9893,WSJAEyExpBY,3,78781,4463628,2151,Reacting To Viral Food TikToks
754,2.9915,WHZSTP5m8g8,0,3597,153473,102,Moments When Things Went Wrong | Incredible Moments (P89)
755,2.9935,VlDTMIgGbRo,3,483404,29616197,22339,I Tested 1-Star Drive Thrus
756,3.0126,z88sps6FI88,7,93468,2590868,3070,Doctor Reacts To Scary TikTok Health Advice
757,3.0146,vWIzeSA4l-0,0,358048,26008866,40087,I Tested 1-Star Camping
758,3.0167,ut8kLRr3FjY,0,480353,31357328,35049,I Tested 1-Star Theme Parks
759,3.0187,sWartg-GwpM,4,439422,23788092,24362,I Tried Every Drive Thrus Most Expensive Item
760,3.0207,pi6QU4kgRXA,0,270283,16435392,31345,Can I Turn Ryan Trahan Into A MasterChef?
761,3.0227,b_MChcA2YXo,0,437813,26967306,11847,I Tried Public Sleep Pods
762,3.0247,bDrNolNVMPg,14,292387,6809855,16441,I Ate Only YouTuber Food Products for 1 Week
763,3.0267,Zp986RMLBD0,0,516240,30974121,18472,I Tested 1-Star Hotels
764,3.0287,VRfDOTsnHqw,2,16106,510339,764,The Story Behind South Park's MOST ICONIC Episode
765,3.0306,VIwwE1QrsWw,0,554866,27024836,20034,I Tested 1-Star Restaurants
766,3.0327,UGFCqzoLmAc,0,1221,34835,1,Best Satisfying Videos - Amazing Peoples And Tools - LIKE A BOSS! #25
767,3.0346,TjnpdIibk68,0,146116,6672187,8029,I got my wisdom teeth out
768,3.0366,TWPE-roOfWk,6,4034,104706,41,Try Not To Laugh Challenge 😂😁😆 ▶️ LEVEL 74 | Instant Regret Fails | Pranks Compilations 2025
769,3.0385,Sw4J-cfYRHk,0,50291,9851439,9640,Minecraft Xbox - Beep Beep - Hunger Games
770,3.0496,vRVg4pgtwdc,3,24907,573671,2045,Being WAY Too Nice to Confuse my Friends on Minecraft...
771,3.0517,iLQlmfJAll4,6,11637,201637,2087,Ranking ALL 96 Tracks in Mario Kart 8 Deluxe! [Tier List]
772,3.0537,gFxkC-zAn1Q,0,2336,48730,406,I Might Have Just Found Mario Kart World's Story Mode Plans!
773,3.0558,b6a46Q8V_9c,0,47420,7160306,8192,Wild Wild Zoo - Hunger Games
774,3.0627,obLZ-yctYok,2,36338,1737585,2382,I Survived 100 Days on NO BLOCK in Minecraft Hardcore
775,3.0807,zrM4G38X2fQ,1,1245,35028,121,TWO PLAYER GIANT vs TINY obby in roblox
776,3.0889,yxmvG3M7ays,2,348714,20352024,37213,The BEST START EVER on ONE BLOCK Minecraft
777,3.0908,tHQa6QNmtfs,6,10844,659051,726,I Killed Minecraft's RAREST Mobs in 24 Hours!
778,3.0928,oOl5b0SkJqE,2,4278,178615,437,i ranked every minecraft mob in a tier list
779,3.0947,nRA3w7VvItE,1,74439,4311248,8688,I Built a CREEPER FACTORY in Minecraft Hardcore
780,3.0967,lV1s7AIFyWA,1,17528,429820,1089,Flying 43,129,189 Feet in Roblox
781,3.0987,eRR-WuauxQ8,1,44760,2526294,2679,I Transformed The MUSHROOM ISLAND Into a PARADISE in Minecraft Hardcore
782,3.1007,cUvcPN4443Q,0,37566,2001920,5124,I Built THE CREAKING in Minecraft Hardcore
783,3.1028,VRvsbK8Tq54,2,8967,234942,571,I Survived 100 Days on One Block in Hardcore Minecraft
784,3.1048,SqJSGjRH7-s,0,41533,7918290,6475,Minecraft Xbox - Springfield Hunger Games
785,3.1181,UZ45k3nbSuw,0,17991,1975822,5934,Minecraft Xbox - Aladdin - Creepy Old Man - Part 1
786,3.1202,SbV8CRF_duA,0,98129,3200734,2469,I Tried To Beat Minecraft Backwards
787,3.1222,SPI7UCmsZ8g,0,15937,5651154,1805,Minecraft Xbox - Lost Paradise - Part 1
788,3.1243,RzgjQ0mPs9o,0,11367,3376769,225,New Funny Animals 😂 Funniest Cats and Dogs Videos 😺🐶
789,3.1264,RhaVbtvbeDA,1,7332,1733410,1053,Minecraft Xbox - Treasure Run - Part 1
790,3.1284,RhPNBgiEhc8,8,5700,140065,444,The DARKEST Youtube ARG You Have Never Heard Of
791,3.1304,RTXS4MMngnA,0,2161890,77842703,118840,Minecraft Speedrunner VS 3 Hunters REMATCH
792,3.1325,RIr0x8q0qRU,0,0,139168,24,Coi Cấm Cười #6 (Try Not To Laugh Challenge) 😂
793,3.1345,R60nMS9EBsQ,1,7360,210617,271,Using NUCLEAR Submarines To Torpedo My Friendships in Modded Forts
794,3.1365,PiAiYBxMjYU,14,86137,1983777,5218,The Internet's Darkest Corners 6
795,3.1384,PcgftonKSLo,1,77355,3545223,2143,I Tried Illegal Minecraft Mods
796,3.1404,PU7YhxFRfEE,10,1944,42166,138,I Survived 100 Days In Minecraft Hardcore! [FULL MOVIE]
797,3.1425,Ofw0mq_8HiU,1,24860,1392662,1230,The History of Minecraft
798,3.1446,ObuYZCSq62U,1,57677,3828064,4613,I Found EVERY DOPPLEGANGER (That’s Not My Neighbor)
799,3.1485,Oa_oEcz7up0,2,211901,11945641,6321,I Cooked Every Food From SpongeBob
800,3.1505,OTYaN-FQtJQ,0,43087,8918955,7690,Minecraft Xbox - Lava Archipelango - Hunger Games
801,3.1574,ymvjfu_Hm_8,0,631460,46054354,42891,I Tried Every Seat on the Most Expensive Airline
802,3.1593,_6cadjbwYe0,10,127113,3443534,3868,Pokemon, but They Keep Evolving
803,3.1613,NgnlawMwPes,1,40787,1454902,682,Beating Minecraft as Mojang Intended
804,3.1633,NLPkz9TJNP8,0,107948,10736923,19686,There's Something LIVING in our Attic
805,3.1652,MaJ-_u4y2BE,4,22503,705316,2025,What Happened to Minecraft’s Greatest Version?
806,3.1672,MH2JHRBQ6ng,0,223635,10281819,6677,This Is What Happens When You Elect a Psychopath as City Mayor - Cities: Skylines II | Ad
807,3.1692,MGGCZZLFZmY,2,23928,837597,901,The Strange World of Minecraft ARGs
808,3.1712,MEpXO5lFvj0,0,15349,5595215,810,THE WILDEST NBA FINALS ENDINGS OF THE LAST 20 YEARS! | PT. 1
809,3.1733,MDyFzn3FTYc,0,12211,281461,704,I BEAT Minecraft on the XBOX 360 & It Broke Me.
810,3.1753,MAZbUyV5mM4,1,47531,1258766,1752,People on this server have been going missing..
811,3.1772,LZLT3P8ZZE4,0,3773,552803,468,Minecraft Xbox - Legend Of The Holy Grail - Sin Claire [1]
812,3.1794,LX1eo_O0F64,1,110968,14405111,14583,TDM vs STAMPY | Mario Kart 8 | Wii U
813,3.1815,KOucsRhIGeo,1,210499,6942700,16892,What Happened To CallMeCarson?
814,3.1834,KMkJjQ6nVSk,0,16235,633945,931,I Secretly used GUNS in Minecraft...
815,3.1855,KLDGFGBmXkw,2,15926,293496,922,we nearly broke up over this minecraft event...
816,3.1875,KGBGXZTQ_KI,2,326585,9929118,9408,Can You Actually Beat Minecraft From One Grass Block?
817,3.1896,K3REtTBRLX0,1,15600,1099029,682,Best Scary Fails | Pranks and Jump Scares 😱
818,3.1914,JzD9Uc7bRK0,16,96062,1942285,8335,Only 56 People Have Beaten This Pokemon Game
819,3.1936,JxrHMARdMjU,1,2845,173343,186,selling 9,763,782 WATER BOTTLES to take over the world in roblox
820,3.1956,JwAxrVNbVM0,15,88316,1635495,5714,The Worst Date Of My Life
821,3.1977,Jtv9bPTPxJ0,1,2493,226061,231,Can I DESTROY Charlie The Steak?
822,3.1996,Jqj0qz6dAcw,1,80496,7277199,5087,I Got a Pet Alien (kinda)
823,3.2016,Jmdm8FlXEu0,9,23936,916673,1240,Busting Rhett & Link Food Myths
824,3.2035,Jl6s6SttN0s,0,250912,11796545,5563,I Built Minecraft’s Most Hidden Bases
825,3.2056,JeTkMdw6RK8,0,1418101,128789807,23572,World's Largest Experiment!
826,3.2076,JeQYF46eGCk,0,7601,133633,569,I Let 1000 Players Build Me A Prison
827,3.2095,JWa03vGLwd8,0,41844,2445356,1461,This Crown RUINED a YouTuber SMP
828,3.2116,JTDllO5y3Ak,0,28787,753259,802,How I WON Mojang's Map Making Contest
829,3.2135,JRjR03he9-8,0,287,9249,29,Why It Sucks To Be Born As A Human (in 1600s)
830,3.2155,JMA1dVjN5cY,0,7438,288547,550,I Got Every Impossible Death Message in Minecraft! (Survival)
831,3.2175,JBFFU6b3kns,1,166192,10870169,14251,Breath Holding Challenge
832,3.2194,J5kh-jTo6fI,0,219117,35173478,11784,Try Not to Laugh Part 1 Clean
833,3.2213,J5HVis7SmP4,0,122051,2831215,6640,"My Minecraft World is Deleting Itself..."
834,3.2361,q4kF83sWp0I,0,65602,1691111,4663,Can You Beat an AI Generated Escape Room?
835,3.2381,hnyPxJ_-jlI,2,47422,1359666,2158,The SADDEST Minecraft ARG You HAVEN'T Heard Of
836,3.2402,g2T-2-mvQgk,0,113726,6339855,5448,An AI Joined My Minecraft World... It Was Terrifying
837,3.2421,atbonqkc_Mc,0,9758,658543,1235,The ROBLOX GAME with a DISTURBING SONG...
838,3.2442,aKZX6VauzpU,0,196589,4207552,10473,Why Minecraft Peaceful Mode is Terrifying
839,3.2462,OSGSROIs8cI,0,101812,2871300,5811,AI Simulates Civilization in Minecraft
840,3.2482,IxsXbxv9qsk,0,10167,1060667,1026,Lies That DESTROY Your Trust! (Funny)
841,3.2501,IuqIAmdwXIo,0,18752,514702,1014,Are These Marshall's Products Worth It?
842,3.2523,Iu8ZmhRphSU,2,4541919,119399574,28250,World's Fastest Workers!
843,3.2542,ItNNk90cO6M,1,42976,3568773,2654,I Fooled My Friend as CATNAP in Minecraft
844,3.2562,Is5NOwFommc,0,195658,15633812,8418,Encanto but it's awkward
845,3.2581,InCrRRjj2yo,9,128121,29466843,4164,The Most Viewed TBT Vine Compilations Of Brent Rivera - Best Brent Rivera Vine Compilation
846,3.26,IkR3iANDA78,9,80063,2769107,21549,Former 33rd Degree Mason Reveals the Darkest Secrets of Freemasonry
847,3.262,Ii8l8Zuxflo,0,48410,11378897,1039,$10,000 Minecraft Manhunt!
848,3.2639,IZW_aYlMYzU,1,4015,243506,411,building the BIGGEST MARBLE FACTORY in roblox
849,3.2657,IYjSmlWG-4A,0,385239,25293121,4165,Funniest Fails On The Internet!
850,3.2676,IXZDGYTqv5c,0,24906,646492,1919,Are We Dumber Than Teenagers?
851,3.2697,IWSk7Az2gnw,0,93190,9729776,7480,World's *FUNNIEST* Minecraft Shorts
852,3.2718,IS0F9IVMLkc,0,224535,14187764,2201,The Story of Minecraft's First Enderman (Cartoon Animation)
853,3.2737,IQJL3htsDyQ,1,537250,15063207,17593,Can You Fool A Self Driving Car?
854,3.2756,IPK9Q1L5A84,0,1519,205712,283,Well, this video aged like milk-
855,3.2777,INsP3N0jjXM,0,7417,451570,527,The ENTIRE Evolution of Minecraft Kids Content
856,3.2796,ILXS-IVyfN4,0,485,7483,82,Memes that are on Point
857,3.2815,IHQr0HCIN2w,3,1013849,53066283,29580,Mexican Standoff (ft. Key & Peele)
858,3.2835,IEbTt64tatU,0,15073,1939223,2332,Our DOG is PREGNANT! 9 PUPPIES ADOPTED!
859,3.2855,IAOyZt6bcCM,0,68,796,0,Paper Mario (N64) - Part 4 | The Video Game Valley
860,3.2876,I7t4hn7uJvQ,0,4596,366828,1077,I Watched ‘Minecraft Movie’ Final Trailer in 0.25x Speed And Found This!
861,3.2895,I7oDQfbu_io,3,33778,897153,4451,The Darkest Family Guy Episode (Banned From TV)
862,3.2916,I6kkxlD-C48,0,44102,1354978,3791,Disturbing Footage From A Dead Minecraft Server
863,3.2937,I4bxOuhl8TE,0,550797,46588829,4635,Impossible Moments Caught On Camera!
864,3.2956,I-uQzd42xNI,6,78432,4562037,3058,How I Became Immortal
865,3.2975,HuCZ6-A5gcY,9,48003,3551698,3190,The Worst Punishments in History
866,3.2994,HrqH-oESxCA,7,93256,2501115,6805,Solving a 14 Year Old Minecraft Mystery - Strange House I Did Not Build
867,3.3013,Ho1AIq4T5Gw,0,61096,4131536,1647,I Tested Kitchen Gadgets From Every Decade
868,3.3032,HnZU7KXp40s,11,48281,7716979,3033,The Full Story of Lifesteal SMP
869,3.3055,HlIHuqFZuUQ,3,2396,87081,307,Minecraft Memes
870,3.3075,HhvCr8NzDKI,2,41112,2723638,2546,MOST Viewed MINECRAFT Shorts! (250M+ Views)
871,3.3095,He2f5OHdW6M,2,8893,144900,713,David simping for Nani for over 6 minutes straight 🌊 (Lilo & Stitch)
872,3.3115,HZtjpxO5rm8,3,118686,4060517,9801,"There's Something Living in My World..."
873,3.3134,HZj3nFdaBD0,0,77329,3454544,3065,Hotel Transylvania 2 but I edited the parts that made me laugh
874,3.3154,HYNqQxhVMbs,0,16406,766664,625,Spooder-Man: The Story So Far (Compilation)
875,3.3174,HYAbcswlmVE,1,10436,3190642,2246,Minecraft Xbox - CandyLand Hunger Games - W/Stampy
876,3.3195,HWj9VeEJxOQ,3,10806,123809,1430,Sonic Spinball: The First Sonic Spinoff
877,3.3214,HUi0Txxdfw4,1,15233,246146,1129,Nintendo Switch 2 Delayed Over Tariffs | Lutnick: Only Jobs For Robots | Trump's Gone Full Dictator
878,3.3233,HTRVphViCio,0,9553,216749,544,Are Expensive Water Filters Worth It? (Taste Test)
879,3.3447,wLl08cJUQNY,0,20085,656171,668,Cheap vs. Expensive Grocery Stores (Taste Test)
880,3.3468,qlu0KU-YERg,13,20021,593232,4362,Woman Horrified By What Police Found On Her Property
881,3.3489,nnsyGSTKlw0,19,162531,2189482,10221,I hate my phone so I got rid of it
882,3.351,nGIa-VL4P_4,11,39298,877035,1644,Doctor Reacts To Hilarious Brooklyn 99 Medical Scenes
883,3.3529,ju1VmIcgnow,0,60885,842575,3064,billionaires are building tacky bunkers
884,3.355,jpSdvpGbL5c,6,7353,82372,788,farmers with brain damage episode 69
885,3.357,hP-rWDdsZ54,1,27891,1067306,728,Can We Find The Food We Ate Blindfolded?
886,3.359,gE6Vm0nY5sg,4,7785,177991,435,Jon Stewart on Signalgate Accountability & Kosta on Trump's Sweeping Tariffs | The Daily Show
887,3.3608,f3v6EBN9iis,34,10775,170687,525,i moved to Finland with SMii7Y, TheDooo & Ethan
888,3.3629,VO_sEshg41A,1,61154,2359806,975,Pro Chef vs. Mom Taste Test
889,3.3649,P9qL7PuLZu4,3,56197,1555361,2020,Eating Spicy Food In An Ice Bath
890,3.3674,OuMRu-JhbVw,9,12767,96318,1184,Relationship Dilemmas That Make You Think | Reading Reddit Stories
891,3.3694,HTL2EPdSYNI,1,5531,447804,141,GMM Will It Funny Moments
892,3.3714,HR1ig6u9-6A,3,1025734,90609721,13270,Extreme Try Not To Laugh Challenge!
893,3.3734,HOmoZXA2iao,8,22811,1463244,2646,Minecraft But I Survive In FOOD CIVILIZATION [FULL MOVIE]
894,3.3754,HIdgilDCPYw,0,400547,10630644,7255,Edna Mode being an icon for over 6 minutes
895,3.3773,HEyqytq0-is,2,678211,117821409,26039,iShowSpeed in Peppa Pig
896,3.3967,yiARNJCiwIc,0,3859,217501,194,Reacting to HILARIOUS Stickman Dismounting FAILS!
897,3.3988,pOlJGajgylA,0,28515,1181573,2247,Try NOT To LAUGH (Peppa Pig Impossible Mode)
898,3.401,pLj1LJALYgA,4,17573,1264866,1376,TWO HOURS Try Not To Laugh Peppa Pig Challenge!
899,3.403,oArkv9osIx4,0,94230,17265594,8260,PEPPA PIG TRY NOT TO LAUGH
900,3.405,mp88N6ItZko,3,247864,16559585,31748,My Criminal Dogs
901,3.4083,lVDoehktzmQ,0,131574,33189640,3257,Minecraft Speedrunner Peppa vs Hunters Season 1 - Full Animation
