order,timestamp_ms,video_id,flag_count,like_count,view_count,comment_count,title
1,0.0248,ORIGINAL,0,0,0,0,[Unknown]
2,0.0287,26M-bU3wMBI,0,4170,114285,492,Allay Tag - Tutorial - New Mini-Game!
3,0.0445,yLEkmfYg5bM,0,48977,1278451,1874,stampy's lovely world: the entire story
4,0.0609,ysQ-dMA_qkk,0,433028,8015097,17701,Game Theory: The COMPLETE Lore Of Minecraft
5,0.0827,vgf2r2KeknM,0,46088,958702,4628,Visiting My Lovely World - Official Download - FAQ
6,0.1008,vso1iMwDuDk,0,61550,862018,4187,I Flew to Sweden to Check Out the Happy Ghast
7,0.1028,v3OV0Gqr_EE,0,66854,1245566,2958,Game Theory: Even the Trees in Minecraft Have LORE...
8,0.1046,trdcprWAaMQ,0,474724,36707882,15756,Break This Ball in 1 Minute, Win $1,000!
9,0.1225,tquErGz0f-o,1,50428,9487417,3792,World's Best Magic Tricks You MUST SEE...
10,0.1434,ykJhE3-Mw8c,0,101422,11066015,14405,All Your Pain In One Video!
11,0.1593,uEHADb77sKM,0,54358,5028737,2336,Real Life Superheroes Caught On Camera!
12,0.1613,tMT1Mu1zX3s,2,53484,7345126,3267,I Made the WORST DECISIONS as a BABY
13,0.1633,rhKnqsxeU6c,7,47575,2210388,1644,The Most Brutal Human Deaths Ever Discovered
14,0.1658,pN0YH74YL24,2,93325,10422924,5420,I Found Minecraft's RAREST Items in 24 Hours!
15,0.1678,ns5wpAYUwss,3,27361,1996423,1872,I Transformed an Abandoned Turtle’s Home
16,0.1696,mscDaDd1ipk,0,220457,4944931,10164,Film Theory: Bill Cipher is Still ALIVE… and I Found Him! (Gravity Falls)
17,0.1716,mrPj0ZXxXcw,0,96944,1925697,5265,Game Theory: Minecraft Mobs Were Created To SAVE Us!
18,0.1742,m6aOMjI6w1o,0,28246,2713034,3518,I Found Axolotls in a Hidden Tunnel!
19,0.1762,lxjVaOE9dE8,0,25420,1218150,3524,relatable moments
20,0.1947,urrO7IAXhsM,0,7023,230425,596,Teaching a Penguin How To Fly in 19 Minutes..
21,0.1965,oQPjO1qTCTA,1,21800,808639,2730,super power tier list
22,0.1984,oAx-YpG9PHk,0,66961,4270157,5524,My Worst Injury
23,0.2003,lXgjOpVz_W0,2,21667,222531,1490,Game Theory: What Everyone Else Missed About the Prototype (Poppy Playtime)
24,0.2021,lWUkHA3yA90,0,179259,30154107,57317,Minecraft Xbox - Cat To The Future [100]
25,0.2043,kpCPUJdFYPE,1,124273,12692946,42948,Ballistic Squid & Stampy - Barely Cooking Contest
26,0.2173,z2u6-0lBKHQ,1,57194,7528552,9567,Minecraft Xbox - Randoms Adventure Map - Part 1
27,0.2192,vry-jbymOIQ,0,26474,525314,1963,Stampy Tries To Bake A Cake
28,0.2209,vitX5zzaV2s,0,89849,2393918,10257,Two Brits try Real Midwestern Comfort Food!
29,0.2227,uEk_pc0xVYc,3,69889,3014456,7857,How Scientology Destroyed A Popular Skateboarding Channel
30,0.2422,wOHUliIp-2c,2,88936,3980514,4392,When Dumb TikTokers Mess With Mexican Cartels
31,0.2441,rifvxNRTxoQ,4,19153,762642,3598,How Scientology Destroyed A Popular Skateboarding Channel | Asmongold Reacts to SunnyV2
32,0.246,l1vVV-iwNOE,6,16261,560459,1731,The END of Adam22 & No Jumper
33,0.2478,kiGjSA8NPpo,10,64448,8325914,3067,How Long Can The Worm Get?
34,0.2774,tRFlk4FhpoU,4,22102,1900721,1005,Using THE MIMIC To Fool My Friends in Minecraft
35,0.2949,xkoKIveoMeY,2,48821,5330430,3416,I Bought BANNED Minecraft Products!
36,0.297,rp_ann1UBJc,0,51018,1953231,2106,I Added The MIMICER into Minecraft..
37,0.2991,rSjQuVzn-CE,3,59175,6330593,3899,Reacting to Weirdest Animations (Funny Cartoons)
38,0.3012,pnZWUhfS5ZU,2,97756,9236726,7297,I Scared My Friend as DOORS in Minecraft
39,0.3032,nnmth3MQ0Ik,0,6856,1061760,460,There's a Massive INFESTATION In My House!
40,0.3053,lv1i8fWwDVY,4,29736,2572966,776,Minecraft, But I Become the Wither Storm
41,0.3072,ks6pZYFB840,0,3463,205511,403,Playing As THE GOD To Troll BABY DASH in Minecraft…
42,0.3097,kbfwASvGsVg,0,52553,5815315,6807,Kids Who Beat The System!
43,0.3116,kFuIikxYVZA,3,82359,13969928,6244,I Bought 100 BANNED Candies!
44,0.3134,kBwPChmLsTs,0,12279,587254,1088,Reacting to NERF WAR in Real Life!
45,0.3334,t-aeK8RzoUo,3,9126,577746,883,Reacting to Weirdest Disney Animations (Funny Cartoons)
46,0.3353,rTIibpJ6v-Q,2,33489,2941854,2506,I Cleaned Every Item in Minecraft, in Real Life!
47,0.3372,rGjkYKU42R4,0,9406,640252,376,How Minecraft is Played with REAL LIFE Laws
48,0.3391,nwrdvjN0Hkc,0,31077,3889035,1813,I Tested 50 Years of Nerf!
49,0.3409,jxU0UalndcI,0,363426,11775486,27683,Game Theory: The Tragic Story of Minecraft's Zombie Pigmen (Piglins)
50,0.3429,jxQi7525h4o,0,611237,80971212,14519,I Built a SECRET Pool in My Room!
51,0.3528,y9_COWCROUk,0,15034,1460103,43,Upgrading SONIC WATERSLIDE In GTA 5!
52,0.3549,jx6bHTqB_NQ,0,9354,427761,585,Flushing My Best Friends Down The Toilet In REPO!
53,0.3568,jMTIyz9BIhs,1,245803,18572343,68033,Minecraft: POPULARMMOS VS GAMINGWITHJEN CHALLENGE GAMES - Lucky Block Mod - Modded Mini-Game
54,0.3589,iw5v4aMu-kY,0,24049,447920,1833,Game Theory: ﻿The Bolts in Ratchet and Clank are Worthless!
55,0.3791,y6hX0qViqLs,1,44258,973996,1964,Game Theory: This Game Will STEAL Your Soul! (Don't Fret)
56,0.3811,xBIFeXLc9VQ,5,29744,616207,1744,Film Theory: Invincible's WORST Villain is...Kid Omni Man?!
57,0.383,woiHzyUv7Ns,5,259056,8520994,12283,Food Theory: The Disturbing Lore of M&Ms
58,0.3849,tWT_6jzQYhc,1,84772,2395297,5038,Film Theory: The Fallout Nukes are a LIE
59,0.3869,pUgGgxwR0A0,0,48055,905418,3741,Film Theory: ﻿Ben10's Omnitrix is DEADLY!
60,0.39,mtai0UHkCmE,0,18548,378680,582,Why Does POPFLEX Keep Getting Ripped Off? | Style Theory
61,0.3922,mYXDOJrqxrQ,4,47058,1194573,3299,Food Theory: The Hidden Dangers of Lunchables...
62,0.3941,iawj93c6Sss,0,22018,1963734,1220,How Long Can Lunar Moon Get?
63,0.396,iQI2EMMeTUQ,1,32361,607665,2341,I adopted 100 LEGO DOGS...
64,0.4217,wFf_VhPLuX0,1,79185,10678960,3099,I made HARDCORE Minecraft in LEGO...
65,0.4239,vfMfv7z0fAM,1,4926,99153,781,I Became King Of Villager City..
66,0.4286,tMaDJhwIMhQ,1,41719,2789207,2283,I built a LEGO Dinosaur SKYSCRAPER!
67,0.4304,sKh7J3SGgCs,0,20650,2314055,1197,Can 1,000 LEGO Hitmen Beat 1 Minifigure?
68,0.4323,qK3UbYLUwI4,1,75931,7002729,10291,I Built Minecraft’s SAFEST Dog House!
69,0.4343,qA6eYLXF2PI,3,431,39719,10,Dumbest Ways to Play with LEGO (Don’t Try This at Home!)
70,0.4362,o17MwjcUTPo,0,8064,772754,324,I Built A Huge Lego Dino Civilization!
71,0.4382,lOKASgtr6kU,0,6132328,288957987,103163,I Saved 100 Dogs From Dying
72,0.4583,zxYjTTXc-J8,0,7607003,507602044,126924,Last To Leave Circle Wins $500,000
73,0.4603,tzZoph8R3PY,0,1083362,29905647,23689,We Helped Paralyzed Dogs Run Again
74,0.4621,tnTPaLOaHz8,0,6803445,379724361,83014,$10,000 Every Day You Survive In A Grocery Store
75,0.464,m34ZKJNyxac,0,1279085,48249494,22004,I Bought Everything In A Grocery Store!
76,0.466,jk6thMe6Vq8,0,1919246,137066619,81827,I Survived 100 Days Of Hardcore Minecraft!
77,0.4679,jgyTwWtvMdE,0,807572,71114868,9183,Luckiest People Alive!
78,0.4863,twkAa-jHDxg,0,66036,6043433,1031,Insane Illegal Experiments in Minecraft!
79,0.4884,tiC8P7Kr2Ak,0,34412,3208183,2191,RARE People With Unbelievable Hidden TALENT!
80,0.4905,plTvQ1g59yM,1,874243,61617674,14235,Extremely Satisfying Workers!
81,0.4924,jdMNoQE3mIQ,0,4170409,210457684,73822,I Survived A Plane Crash
82,0.4944,iAQaHHbHoUs,8,3846,170998,1132,The Rise and Fall of Braille Skateboarding: My Reaction
83,0.4963,i5eohB0OiKY,0,18255,1241223,1340,Using POPPY PLAYTIME to Fool My Friends in Minecraft
84,0.4982,hcC422wvjZo,0,120491,12805232,6327,I Built a SECRET Zoo!
85,0.5001,hHdKug_wQkU,7,149032,8544455,6124,Walking on Water Prank!
86,0.5019,gsWPpE4Rid0,0,4102464,169226063,65784,Videos I Could Not Upload...
87,0.5038,gq4pYKBJJcw,2,36061,1028571,3587,I Worked 7 Days at Roblox JOBS
88,0.5057,gmXsL_nqTjA,1,55213,3647823,8515,dumb stuff we did as kids
89,0.5076,gdrKuYwsq8s,0,131270,2660422,4139,Game Theory: Minecraft's BURIED History (1.20 Update)
90,0.5095,gaFdVG503rw,0,208504,6905899,22384,Game Theory: The Secret Identity of Hollow Knight's Hero (Hollow Knight)
91,0.5115,gZRS143PFqI,0,159712,14523934,10567,If You Protect It, You Keep It!
92,0.5135,gQYvu7zTeLg,3,24408,2457670,839,All Your Pain In One Video!
93,0.5154,gJcAEclfw9k,0,154827,13605436,15312,If You Build It With 3D Pen, I’ll Buy It!
94,0.5174,fcRGd4sty7w,19,29274,2119483,4337,EVERYTHING tier list
95,0.5194,fUSvNzzrXX8,0,113310,19366032,8379,Eating GUMMY vs REAL Food Challenge!
96,0.5212,fRKHN-quT8E,0,60146,6670776,7365,Disney Movie Recap Cartoons (Funny Animation)
97,0.5364,zrNeM_Oz79Q,2,60075,6925183,12695,Pixar Movie Recap Cartoons (Funny Animation)
98,0.5385,qxmG9b17qM4,5,3891,202700,314,Using ELMO.EXE to Fool My Friends in Minecraft
99,0.5405,mbNH60KQ9to,5,6435,577537,1012,Video Game Recap Cartoons (Funny Animation)
100,0.5425,l4yLC3zljCM,1,28548,3260744,3334,Cartoon Logic That Makes NO SENSE (Funny Animation)
101,0.5444,fMfipiV_17o,0,5684267,350926745,139873,Would You Sit In Snakes For $10,000?
102,0.5464,fEonWIMxAlc,2,10408,666751,1866,Why Skateboarders Hate Nyjah Huston
103,0.5483,f9sqUaj5XsQ,0,15551,1557642,1407,Reacting to GODZILLA vs SIREN HEAD (Animation)
104,0.5502,esDlUtMQmeU,0,1009333,79781319,17805,World's Cutest Animals!
105,0.5521,eN1bgtob15A,0,41602,2124074,4367,The *LUCKIEST* People Alive…
106,0.5541,eKJEqVfigMY,0,5581,246303,165,I Built the Life of STEVE in LEGO...
107,0.5561,eGmHrgL2doU,2,49476,5310562,3596,How Big Can Siren Head Get?
108,0.558,drvPVTMQ8fU,0,157508,4849219,7406,Film Theory: Mario is IMMORTAL! (Super Mario Movie)
109,0.5599,drmol0Qm8QI,3,39300,5778698,3050,Try Not To Laugh Challenge!
110,0.5618,dqj9a-Ae0zM,1,28740,2645386,1004,Using INFECTED SKY To Fool My Friends in Minecraft
111,0.5637,dbknEoTgKcA,1,20233,1773054,957,How Minecraft Mobs Act if They Were Parents
112,0.5658,dMCRerWiEQ0,0,47859,5482858,2180,I Survived 100 Days as a WORM in Minecraft
113,0.5676,dIHf4gxBqIQ,2,9996,168243,937,Why is Gen Z Going Grey So Early? | Style Theory
114,0.5694,dCrM0pjhBbE,0,374278,10594513,7901,This Minecraft Video Will Satisfy You Forever
115,0.5713,dARtcG5DFkY,0,225474,33962477,21017,I Snuck Into an Amusement Park OVERNIGHT
116,0.5734,cwS7LU1IvMg,0,28486,2056094,3012,FUNNIEST Kid Test Answers
117,0.5752,cuLPmTaffBE,3,22922,1580142,444,Million Subscribers Battle 1
118,0.5771,crtr8c5Y09A,0,5831,195019,547,Fastest Way to Get Fired
119,0.5789,cAAOVKZBR9E,2,82749,10249698,4688,I Learned Extreme Camouflage to Escape the Police!
120,0.5809,c1BtIdeNeOg,0,94092,8768736,21204,Minecraft Xbox - Town Tour [600]
121,0.583,bSSZ3urVD7g,0,52000,2118687,1379,I Secretly Exploited on a Youtuber SMP!
122,0.5847,bMnLf5KFSos,4,794712,50393352,21693,Exploring the Scariest Google Maps Locations!
123,0.5866,bI0CjBZE9KY,0,17701,1245038,1989,Best Fish Tank Wins $1,000!
124,0.5885,axKYpjWMkfU,0,20844,397028,1449,Game Theory: I Already Solved The Next Garten of Banban (Chapter 8)
125,0.5902,al2bw3ujPJk,0,40768,5986555,3677,LEGO, but you can EAT it...
126,0.592,aO3suK9QfBc,3,23507,899028,4367,Jaden Smith: The Nepo Baby Who Couldn’t Make It
127,0.5939,aC4805RAGaI,2,9518,212611,921,How greed destroyed Angry Birds
128,0.5979,aAHPaQlafSI,7,73373,3254372,6789,The Cult of Scientology
129,0.5997,a6U6AobyWtw,0,829110,31892586,10273,Saving Endangered Animals From Extinction
130,0.6063,_tifalqP1sE,1,22492,1377617,1256,Spongebob Movie Recap Cartoons (Funny Animation)
131,0.6082,_SAWKHNC6ME,0,2348,48314,237,Reacting to ANIMATION vs MINECRAFT!
132,0.6101,_H4XmWGUcZI,4,32632,1722024,3919,World's WEIRDEST Design Fails! (Funny)
133,0.6119,_8nAljpyglE,2,2042,24383,385,If Rekrap2 Had a Trailer
134,0.6376,zCi9oHfS83A,2,9375,327585,976,Why I Killed My Best Friend's Dog
135,0.6397,sYbCgji7l-0,2,49552,1015729,6413,Bedrock. Why?!
136,0.6415,ofdc8yWGiaY,0,4797,35709,345,The Hidden Science Behind Minecraft Mob Spawning – A Minecraft Video Essay
137,0.6434,oDmAQFVC9vg,1,150005,4849621,5288,How I Ruined this Superpower Server
138,0.6454,ihyluPPzHig,2,27613,568124,2182,How I Obtained Lifesteal's Only Mace
139,0.6473,eQH2VdsUkQM,1,10761,344134,764,How Minecraft SMPs Became Scripted
140,0.6492,dS7o5cjp2CU,2,8790,246677,892,I Got Lifesteals Strongest Weapon
141,0.651,ZmYkSYZ6Hfg,1,23990,447480,1098,The Time We Asked Carl Sagan to Nuke the Moon
142,0.6529,Zgwfa9zruTA,4,2668,221480,195,I Ended ALL OF HUMANITY in Just 60 Seconds
143,0.6549,Zb01RStdzEs,2,853157,45679183,18488,Candy Thieves vs Rigged Candy Bowl
144,0.6568,ZUe_rGk3jIg,0,2611,260466,133,How to Get a Girlfriend in Lego - From Nerd to Chad
145,0.6587,ZKBJTMpFqOo,0,3997,60399,775,I Played Mario Kart World! Is it Worth $80?
146,0.6617,ZCzeYQcDguM,0,3380,105593,164,The Forgotten Helpers of Stampy's Lovely World
147,0.6786,sMU5K_m9auA,1,21603,1003111,1217,What Happened To Lifesteal SMP’s Former Members
148,0.6974,ztC2pyHymU0,1,30441,816100,3132,How Micro-Transactions Destroyed Plants vs. Zombies
149,0.6994,uWVE14fZzco,0,347411,14644950,21276,This YouTuber Faked 100 Records, So I Actually Beat Them
150,0.7012,m36uLhIoNvg,1,5803,282603,435,Every Minecraft YouTuber Who Vanished (& Why)
151,0.7171,vfcAz0jeWkE,4,36615,698922,3597,Why Minecraft Kids Content Is Horrifying
152,0.719,tbZvfawLZOI,6,25553,999919,1346,JinBop: The Minecraft YouTuber Arrested By The FBI
153,0.7209,lShXplxnirw,0,36341,967927,1395,How Civilization Videos Broke YouTube
154,0.7229,kSC_4Dt_WKM,14,9988,160353,900,Corrupting Minecraft until it breaks
155,0.7248,jkfO5E-T4I8,1,53964,2095968,4589,YouTube Channels Abandoned for Disturbing Reasons
156,0.7268,ieIwxZaLOGw,5,41118,713723,3381,How I Won Minecraft's Biggest Event
157,0.7287,epmxiSblsKY,1,2512,68323,159,How a Technoblade Shoutout Ruined His Career
158,0.7306,b3jwuYo9eio,17,26639,2224394,1654,I Spent One Year Tearing This Server Apart
159,0.7325,a-P9dWtjP6o,10,96483,1662153,3212,Making Serial KILLERS Adorable | Beneath the Trees Where Nobody Sees EXPLAINED
160,0.7525,y0noIVa3pS4,5,96324,2963363,10932,Horror Movie Monsters You Have ZERO Chance Surviving
161,0.7546,xlg5yLuO32s,5,19262,288436,713,This Adorable Comic Has a DARK Secret | Beautiful Darkness EXPLAINED
162,0.7563,sW5I8-Vz2ZM,7,15715,581371,1234,Worst Crimes Committed By Kids in 16 Minutes
163,0.7583,qLNcg3t_KtI,1,22101,568603,1136,The How To Train Your Dragon Horror Infection AU
164,0.7604,khe37lNo7E8,6,11197,316194,605,Deadpool Loses It, Saves a Kid From a Predator
165,0.7623,is_b5owwFCc,10,10250,283115,794,The Kids Movie That Traumatised Millions
166,0.7641,c2-IsAORSZM,7,135033,2851876,6396,How Lacey Games Explores Girlhood Trauma
167,0.766,_-eDrZimLK4,9,21528,843053,1374,Can I Survive Lifesteal SMP Without Fighting?
168,0.7679,ZGEyWViDXjg,21,28872,701587,1232,What Happened To EVERY Dream SMP Member
169,0.7698,Z32Y-D5kJTg,21,34343,1218997,5452,The Sociopath YouTuber Who Destroyed His Life (Hiding In My Room)
170,0.7716,Z18hg00lVrQ,3,309,39101,27,#loganpaulprime #wwe
171,0.7736,Z-a280rc5P4,0,38779,3734472,2563,Destroy the Unbreakable Minecraft Block, Win $1000!
172,0.7755,YtMgIDxGHnk,0,33800,1872530,2483,Sleeping in the Most Dangerous Beds in the World
173,0.7773,Yo8UzbQQH3k,1,180734,3616665,13988,history of the entire world… according to bread | Food Theory
174,0.7792,YlX2j5ylf2A,0,21168,2234599,3987,I Found a LIVE Fish Vending Machine...
175,0.7811,YQDDm9HLkV4,0,5010032,263440732,208252,I Adopted EVERY Dog In A Dog Shelter
176,0.7831,YHG6PbDVtv8,1,632691,17292266,54710,Revisiting the OLD MINECRAFT LAB.. 3 Years Later..
177,0.7851,YCjpzVFAhQQ,0,14754,2679976,1031,Expensive Fails Caught On Camera!
178,0.787,YCYAHABlS5U,0,27942,3108159,6562,Weirdest Cartoon Mistakes You CAN’T UNSEE
179,0.7888,YBn1HYbFxLo,6,208318,9504077,16930,How 1 Joke Collapsed A Popular YouTube Podcast
180,0.7906,YAJHWEzPnb8,0,685971,45623289,27125,FACING 1,000 FEARS IN 24 HOURS!
181,0.7925,Y8oHQ7-1LE0,1,67843,6046462,3756,I Survived 100 Days as TOOTHLESS in Minecraft
182,0.7945,Xu4qqpjWbvI,0,588212,74277172,15393,I Built a SECRET Survival Bunker!
183,0.7963,XpS20kVdnvw,0,2851,43100,323,How Minecraft YouTubers Avoid Getting CANCELLED...
184,0.7983,Xj0Jtjg3lHQ,0,4756900,212396581,54709,$1 vs $500,000 Experiences!
185,0.8168,vgPJZ1ktT50,0,15500,210367,1883,Cooking Challenge vs Dude Perfect
186,0.8188,vBpQ1SlfVtU,0,5582019,230409583,142736,Lamborghini Vs World's Largest Shredder
187,0.8207,u6D7JcrV8Ck,0,123791,8613835,4088,Defeat This Minecraft Boss, Win $100,000
188,0.8225,pZ-MpxDZr9I,0,876462,36855251,25868,We Gave Every Family in a Village a Full Year's Salary
189,0.8247,krsBRQbOPQ4,1,5632253,302418375,100574,$1 vs $250,000,000 Private Island!
190,0.8266,jObOjhUkf50,0,6452978,329849292,106671,$1 vs $250,000 Vacation!
191,0.8285,iogcY_4xGjo,0,7332927,391181444,114138,$1 vs $1,000,000 Hotel Room!
192,0.8304,h5Zwg3Ag-bE,1,549068,32242898,7533,Lasers vs Lightning- Which Is More Powerful?
193,0.8322,XZZdcai1oIE,0,73045,8279423,4885,Level 1 to 100 Minecraft Science Experiments
194,0.8495,y2P4HVGD3lE,3,3447,438321,230,EVERY ILLEGAL Building Technique in LEGO
195,0.8514,phV1_XIOMpI,0,172528,11051957,13819,I Collected Every Block in Minecraft, in Real Life!
196,0.8533,p_RI2V93jFY,0,51532,6174535,3660,Level 1 to 100 Satisfying Minecraft Experiments
197,0.8551,kkd96ca-U2Q,0,39601,1706304,4207,I Got Hunted by a Minecraft Redstone Genius
198,0.8775,yIpms96cr1o,4,95302,2359441,3254,How Speedrunners Broke My Rage Game (Get To Work)
199,0.8794,xnDjbV-C8i8,0,3690,110863,598,The Search for Minecraft's Last Tree [FULL MOVIE]
200,0.8814,qBO1TXF8jdQ,5,103866,3528390,6352,I spent 2 months digging secret tunnels. Here's what happened
201,0.8834,olL0XFoPRZk,1,83612,11052391,9598,Escaping Proton: Minecraft's Most Secure Prison
202,0.8854,nNMheft9dko,2,20583,792708,1747,I Became Minecraft’s Demon Slayer
203,0.8872,k7dKzwicrSY,0,56945,6178555,5033,Testing 100 JAVA vs BEDROCK Myths in Minecraft
204,0.8891,jhfy8axRH-U,0,68294,6326713,7992,I Tried Eating Every Minecraft Food in Real Life!
205,0.891,itV8GMdJzJw,1,167803,2546316,8689,Every Stolen Redstone Build On The Dream SMP
206,0.8929,fZyItdzjI7I,5,12560,194984,1433,One Million Armor Stands
207,0.8948,ZeTQAuvjFLQ,4,45658,6961505,5960,I Survived Minecraft's Most Corrupt City
208,0.897,XYONrlEQs_g,3,476864,24814088,18485,LAST TO LEAVE THE COFFIN WINS $10,000!
209,0.8989,XUP23K1I8Xk,7,76107,1733690,2800,I CHEATED In Roblox Most Popular Games
210,0.9007,XNPp15KS1EM,0,3893,548228,98,This Ad Game went TOO FAR..
211,0.9027,X-EHX2nJ9jM,0,22128,1119483,1260,Using OG Minecraft Traps To See If They Still Work
212,0.9046,Wdjh81uH6FU,1,4577819,238781062,61059,$1 vs $10,000,000 Job!
213,0.9066,WQPUpXHGDN4,0,28688,1417969,1529,Escape This Prison, Win $100,000
214,0.909,WHmyvpA_EPY,3,26849,1103810,2093,How I RUINED My Friend's Minecraft SMP
215,0.9114,WEaR5CulE_E,10,24166,1834296,1203,How Long Can The Ant Get?
216,0.9139,Vw_8TMlZ3rk,4,26684,1182904,2301,I Fought Lifesteal's Deadliest War
217,0.9346,vNvaLvLj7S0,1,40488,814563,2948,Getting 20 hearts on Lifesteal Season 6
218,0.9365,uPjzwU6IhqU,1,8338,119894,892,How To Become Unkillable In Minecraft
219,0.9386,krVeRDgEEws,0,17866,618973,1959,I Fought Lifesteal's Deadliest Battles
220,0.9405,kKwXszQ_vgc,0,17210,642229,1868,This Vault Destroyed Our Server
221,0.9425,ete_suqdHF8,0,24951,1255601,1168,I Secretly Duped on a YouTuber SMP!
222,0.9444,akSX0Qfyf3g,0,35837,1533406,1098,Battle Royale, But Every Drop Is Random...
223,0.9464,WL8ye_MLsZU,0,16189,916930,1137,I Survived a $200 MILLION Bounty
224,0.9483,VuBpiii1WBw,0,108726,28355916,21082,Minecraft Xbox - All Play And No Work [99]
225,0.9503,V_9-vDKnVno,8,23659,1015788,1914,YouTubers Who Were Exposed As Predators
226,0.9522,VTkSnYo0hdk,14,15796,390759,3037,The Aftermath of Shadman
227,0.9541,VIt8YYvivas,1,4250,423699,210,We Added EL GRAN MAJA into Minecraft…
228,0.9561,UU94kI6SgLg,0,400993,42783805,39488,My Daughter Survives WORLD'S STRICTEST SCHOOL
229,0.9581,UPChgJD_lgg,0,9043,648964,1713,Kids On Another Level!
230,0.9603,U9jNWcM2npE,1,373,39723,8,Minecraft Real Life Trailer VS ACTUAL REALITY?!
231,0.9622,U7TCIEmotdI,0,33486,1378429,2587,I Spent 100 Days Hidden in a Secret Minecraft Base...
232,0.9822,yGVa9Ots_fg,2,13767,1111738,1082,I Found Minecraft’s Rarest Secret Room!
233,0.9841,vt8Z-lO8gmc,3,67891,2516189,2300,Every Unique Item Expands the Border
234,0.9859,vrtAgbKwXlk,0,6212,366295,711,The DARK TRUTH about Minecraft MOBS...
235,0.9879,thn7fYe9tQg,0,245696,7735725,6136,Breeding Pigs Until This Server Bans Me
236,0.9898,o6vpguNzaBA,2,67719,4831728,1731,I duped 3,600,000 items in Minecraft…
237,0.9918,nLfzf2LElsA,2,103469,3926324,6584,Joining The Deadliest SMP (again)
238,0.9937,iZRwPq_MXJ0,2,187809,10281225,3386,X-Raying Until This Server Bans Me
239,0.9956,iJk8BPKtxLs,3,31868,1773227,1308,The Legendary Secret Tree Base in Minecraft Hide or Hunt
240,0.9976,cAgOtuVIgRw,0,47673,4380540,936,Minecraft, But You Mine 1,000,000 Blocks!
241,0.9997,blTD03napcA,1,6204,200374,465,Fortnite is TEASING Season 3!
242,1.0015,U0Z29SlLF38,3,37672,963612,4317,Minecraft's Biggest Kid's Creator Just Got Exposed...
243,1.0225,x62IoA1cmDE,0,62060,1994929,2272,The Animators So Good, Mojang Hired Them
244,1.0244,vsPpn-5f1g8,5,5834,95631,371,Idiots Laugh At HILARIOUS Name Soundalikes
245,1.0264,vA4LCfMWnqk,0,8,209,0,Grinding Hypixel Skyblock | Chill Vibes & Big Progress! 🛠️💰
246,1.0283,intPRquE2Bw,3,22551,383644,1159,The Disturbing Flash Game Everyone Forgot About
247,1.0302,e_leuXlDdnA,4,9759,325188,909,Ice Spice Just Lost Everything...
248,1.0321,e0h0NaMrPis,12,38565,531290,1307,Iron Man explained by an idiot
249,1.034,dLKX-9jO9nk,2,3668,81005,497,YouTube’s Most Disturbing Kids Animator…
250,1.036,aprhow5QVTs,0,1507,27655,223,WALK with JESUS | Lenten Reflection with Fr. Jerry Orbos, SVD
251,1.0378,VoTb03PEVQU,2,15751,323742,1118,Movies I Thought Were WEIRD 2
252,1.0398,VRBec_qIAzU,1,192068,9207794,9399,The Story Of Minecraft's Dirtiest Predator
253,1.0418,UWokiLw8Yc4,0,527,8037,0,Tactical Solos THEN Live Voice Trolling
254,1.0437,TtVKfqquGwA,0,35007,1797140,3622,I Got Hunted by the World's Best Minecraft Player
255,1.0456,Ti9s5DlUXnE,3,12455,236536,659,The Dog In This Movie Is A Sociopath
256,1.0475,TKDUtuc9s9E,7,44863,2907832,4597,pain
257,1.0495,T9VzDHrCn6U,0,9134,296820,1432,We Defeated THE WITHER STORM in Minecraft
258,1.0657,Ss5ggp8Ij14,15,23640,2616992,3887,I Infiltrated The Minecraft Mafia
259,1.0846,x9-V64fR9sU,4,18277,1364745,2868,The End of the Minecraft Mafia
260,1.0866,bD7LI-SBQQk,5,4,257,1,Ruining My Friends Netherite Beacon (Tectonic SMP S2 Ep19)
261,1.0885,ZAtcZHsqeWc,9,4,317,0,The Minecraft Movie made me play this again... | RLCraft Reignited
262,1.0904,YPExvQkv_iI,7,25475,3443924,3519,I Mastered Minecraft Combat
263,1.0923,WsDyRAPFBC8,0,114455,28503689,9,Deep & Melodic House 24/7: Relaxing Music • Chill Study Music
264,1.0943,WXJGhbHuIJA,13,22897,1454712,1439,I Became the Most Powerful Player
265,1.0962,TcEPha03_WE,6,18525,2260988,2177,I Got Hunted by the Minecraft Mafia
266,1.0981,SjslOuaEC0c,0,45621,3616835,2768,Peppa Pig Family VS Minecraft! (Funny Animation)
267,1.1001,ScQ1o_bgELk,4,79297,1816290,5423,Game Theory: Buckshot Roulette's NEW ARG Is Unsolvable... For Now
268,1.102,SPQZ6EV58Ws,0,64264,4899599,7747,World's Dumbest Parents!
269,1.1039,S6_A_u_l59E,1,23150,1091643,1664,Where Are OG Gaming YouTubers Now?
270,1.1059,RwvCKetYXwI,2,162076,3390916,6968,The Entire FNAF Timeline
271,1.1083,Rsxao9ptdmI,0,1564203,104583240,19914,Beating 5 Scam Arcade Games with Science
272,1.1104,Rnfv15oHWUY,12,83907,4204394,7901,The Dark Life After 15 Minutes of Fame
273,1.1123,RcnLg8K7IAY,0,15783,1163001,1455,I made MORE CURSED Lego Dinosaurs...
274,1.114,RcTLBsXvzQk,0,767682,70903708,8738,Most Dangerous Animals!
275,1.1159,Ragtw8xGYeo,1,18048,362108,1388,Roblox's Worst Type of Pr*dators
276,1.1178,RYw66aBuTj4,4,19803,1039843,3551,Roblox Youtubers Who Were Exposed As Predators
277,1.1198,RRcGmIPYRB4,0,55308,1095684,10025,Film Theory: The DARK Truth of Disney Magic (The Disney Theory)
278,1.1216,RNSMTcbzHZU,0,30134,1685655,1897,Realistic Minecraft - THE MOVIE (All Episodes)
279,1.1235,RNRvYXKxiIE,0,188945,5996103,5105,Film Theory: Fairly OddParents BROKE Its Own Rules! (Nickelodeon)
280,1.1253,R5od3UBOn5U,0,22994,2544615,1486,Using EL GRAN MAJA to Fool My Friends in Minecraft
281,1.1271,QzdXvSC7mbg,1,53758,1036087,3105,Film Theory: Animator vs Animation LORE Will Make You Cry!
282,1.1291,QylrQhP8dqc,0,213383,12638241,5018,I Got The Worlds Best Minecraft Armor
283,1.1309,QbNjnDEflsQ,4,35642,1219245,2372,I Built The Death Star In Survival Minecraft
284,1.1329,QXZtOB8rfeQ,0,27793,4093317,4422,Everyday Things You've Been Doing *WRONG*!
285,1.1348,QRzE1z2RxSo,2,106802,3459110,7761,Trapping everyone on my server with 1 piece of sand
286,1.1367,Q38CGW89NQE,2,105,44252,1,SONIC 3 🔥 SONIC TURNED INTO DOG MONSTER SEEKING REVENGE FOR AMY ROSE - Story of Transformation
287,1.1385,PsxzF8N-y88,3,56537,1365400,14771,How an Entitled No Name Actor Destroyed a Disney Classic
288,1.1403,PlGOst7Az9U,1,36765,965804,1921,I Broke 1,487,000 Blocks Under my Enemy
289,1.1421,PdYsyt8bb24,1,55574,2077027,2430,What Happened To Hermitcraft's Former Hermits
290,1.1439,PJPP8w6CSOs,7,20997,436575,1204,I 100%'d That's Not My Neighbor. It Was Nuts.
291,1.1458,PFRf0WGPm9s,3,10903,127448,911,Discord is Broken and They’re Keeping the Fix a Secret…
292,1.1671,zMZY6hsYFxE,0,32992,1013986,1758,The Most Unsettling AI Websites On The Internet
293,1.1691,wkVygetgeRY,8,38597,727458,2370,The Hunt for America's Smartest Serial Killer
294,1.1711,wKb22lWjSe4,80,25812,488733,4409,Debunking The Biggest Drug Myths
295,1.173,tGmmQ688Fkk,26,26263,1813339,1014,Vine Compilation that gives me my will to live also RIP Vine
296,1.1748,sB-0WAmpM9g,1,46977,2810533,3044,Showing Scammers Their EXACT Location ON My Computer!
297,1.1767,pE8EkB0X27A,2,27570,906773,1571,The Discord Dating Bot Rabbit Hole...
298,1.1785,p1dEHhXXHGI,2,122168,9514362,22137,How to Instantly Get a 5-Star Wanted Level
299,1.1815,nfworEF3CGs,1,50624,2528935,1961,Infiltrating Roblox’s Fake Middleman Scam
300,1.1833,f2dLivXEuLk,4,14603,343837,1086,How Catfishing is Making Discord's Biggest Problem Even Worse...
301,1.185,SkPSowwjiEg,0,53382,825133,2580,Creating Water Out of Air
302,1.1868,SSzWUzWD-o0,12,14703,458390,1056,The Biggest Scams In Human History
