order,timestamp_ms,video_id,flag_count,like_count,view_count,comment_count,title
1193,4.3892,sQOb0ct1p-0,0,41461,1479639,2293,I Built a Working Submarine In Minecraft
1194,4.3913,lFrsIC0hP9k,5,6550,148644,275,Can YOU Guess what's wrong with these Minecraft Structures?
1195,4.3933,kPoiF8L96lc,0,5475,144535,290,Can YOU Build these Minecraft Structures from just YOUR Memory?
1196,4.3952,bxX76HMgx98,0,113291,2442440,3990,The Simplest World That Can Farm Every Item
1197,4.3973,XAgnogeGY7M,0,42836,1319447,2605,I Coded Minecraft Features Nobody Asked For...
1198,4.3991,JQtq67raGfI,0,3312,64265,508,Can YOU guess which of these Minecraft items is the Odd One Out?
1199,4.4012,ItrJY7L1VNI,0,3723,77668,334,If YOU Guess the same Minecraft Item, You LOSE!
1200,4.403,Fv26W6ja5wk,2,9520,379054,297,Last Person to find me is ELIMINATED - Minecraft Geoguessr
1201,4.4051,FoKL13S8o1Y,2,41813,1025328,1468,Minecraft memes but the movie is out now so...
1202,4.4071,E_khkDp5NqE,4,33181,1045780,3450,Can YOU Guess what's wrong with these Minecraft Images?
1203,4.409,EKL50ccXyAw,0,41805,1083550,1214,Minecraft Button Experiment
1204,4.4109,CWNhVoJMdZk,1,2685,84515,757,Neil deGrasse Tyson’s 25-Minute TAKEDOWN of Christians
1205,4.4131,CJS3WkgN2KI,14,8453,214863,623,Ranking Nintendo's Launch Lineups
1206,4.4151,CFCvWnhLSi0,0,43881,2676808,1348,The Ruthless Rise of ClownPierce (Lifesteal SMP's Deadliest Player)
1207,4.4171,CCRX91F3FZc,1,87265,15626786,13701,Minecraft Xbox - Enchanted Kingdom - Hunger Games
1208,4.4259,wOGD9zfqEkk,0,111001,4287705,2663,Giving 10 Kids Supercars
1209,4.4495,s1ax8Tx_Jz0,0,4097029,222091662,150732,Would YOU Rather Have A Lamborghini or This House?
1210,4.4727,v9WSjE3tIkg,0,2254375,94986458,32974,World's Most Viewed TikToks!
1211,4.4747,tRMGdWValIk,0,813969,44440283,29099,Last To Stop Customizing Wins Lamborghini
1212,4.4767,qIsgdOVGA04,0,4779084,190861135,126693,Last To Take Hand Off Lamborghini, Keeps It
1213,4.4786,mKdjycj-7eE,0,5140506,203363314,123867,Protect The Lamborghini, Keep It!
1214,4.4807,iSvsf27wRns,0,2260168,110679098,74289,If You Build A Lamborghini I'll Pay For It!
1215,4.4828,hDYFFYUzxQQ,0,1440656,91051140,27672,World’s Most Expensive Car!
1216,4.4847,enevSuDgf3U,0,42927,1061761,1212,Inside Disney's Secret Test Lab
1217,4.4867,bTrV5v7GLcQ,1,3346868,183529347,81978,Last To Leave Pool Of $20,000 Keeps It
1218,4.4889,_qAJMXfL6o0,1,4117439,252888472,120751,Would You Rather Have $100,000 OR This Mystery Key?
1219,4.4909,_iz5_DuY_II,1,862013,60985285,13195,Most Expensive Airplane Ticket!
1220,4.493,ZNVlIMHS1sk,0,2772429,75082072,86309,Donating $50,000 To Streamers With 0 Viewers
1221,4.495,WvkSO5ne7fc,1,10440,659994,645,I Sunk My STRONGEST Magnet To The Bottom Of The Lake
1222,4.497,UE5AHE2Ypr8,0,4764057,198376007,184207,I Gave My 40,000,000th Subscriber 40 Cars
1223,4.499,P_6my53IlxY,1,1268786,93278046,36748,World's Longest Field Goal- Robot vs NFL Kicker
1224,4.501,OirsSL5rsVA,0,71,2387,4,Minecraft - Plastic Texture Pack - Showcase
1225,4.5129,hw6y5AaOWss,11,30030,3367672,6561,Testing Minecraft Seeds That Are Actually Scary...
1226,4.5292,zJTcyFeWOQw,0,9259,308883,2327,The SUPERMARKET City Got a HUGE UPDATE! (Part 27)
1227,4.5313,y3Zza0l-tPk,0,20877,1511700,817,Peppa Pig VS Minecraft! (Funny Animations)
1228,4.5332,pD1Vom9nfB8,2,28071,2364848,4358,Testing Scary Minecraft Seeds That Were Forgotten
1229,4.5489,up98-Hj7EbI,7,34092,2823366,5955,Busting Scary Minecraft Seeds To Prove Them Actually Fake?
1230,4.551,pXa92qsNTCA,22,91566,5501850,16498,Testing Minecraft Lies That Are Actually Scary...
1231,4.5531,lmWcK-Z15oc,0,4388,161327,730,Poppy Playtime Chapter 4 TRY NOT TO LAUGH CHALLENGE #2!
1232,4.5738,z77gmo9WGyY,0,4747,232616,643,Poppy Playtime Chapter 4 But With CURSED MODS!
1233,4.5759,y_vW1FW8xUM,15,41845,4394225,8696,Busting Scary Minecraft Lies That Are Actually Fake
1234,4.5779,pNWNgQfd3-s,0,6157,218516,900,The TRUTH Behind The Hour Of Joy! (Poppy Playtime)
1235,4.5799,kvTE9I9DPD0,0,865,18745,139,The Uncanny Horror of Early Minecraft You Forgot About
1236,4.5819,kQ5yqqEPEwA,2,14663,2819777,592,Poppy Playtime Chapter 4 in LEGO | I recreated All DEATHS from The Game
1237,4.5839,kIQJTiR-DxQ,1,13064,656403,1439,WEIRD Squid Game Animations TRY NOT TO LAUGH CHALLENGE!
1238,4.5859,kBC211AsHZs,3,55758,4577066,3646,exploring the history of minecraft all in one video
1239,4.5879,itrRZ7kFk1s,5,774,34117,90,Only 1% Can Solve This Murder…
1240,4.6086,tiIRGtA9MZQ,0,6452,342997,832,Types of KIDS Portrayed by Minecraft (Funniest)
1241,4.6107,psXy0AVE3Bc,0,1607,167375,349,Worlds FUNNIEST School TikToks!
1242,4.6127,lwfUUY1lKLQ,0,1387,100324,94,Creative Workers on ANOTHER LEVEL! (SATISFYING)
1243,4.6148,irj9KwORrgA,0,3459,316687,281,How to Sneak Candy into the World's Strictest School
1244,4.6169,gRQ0JMG4FWA,0,11720,1118828,1333,I BEAT ZOONOMALY! [Full Game ENDING]
1245,4.6189,eRsdH4fFqGY,25,35276,3325930,3894,I SCARED My Friend When He's ALONE in Minecraft...
1246,4.6209,e3Ss5OMp1PI,1,25609,2053758,1895,Exploring The World's Most Dangerous Hotels!
1247,4.6229,bEkFEbM64s4,0,393,31171,59,i told him not to DIVE there...
1248,4.6249,aGuhEBFoOjA,0,31658,730656,2041,Ranking EVERY CONSOLE TEXTURE PACK
1249,4.627,aCMCc0i9QSE,6,57270,6423441,13115,Testing Scary Minecraft Things That Are Insane!
1250,4.629,_fmeR-UhEMI,37,57913,1173752,4317,I Made A Game, But The Players Are Insane
1251,4.6311,_Xt0u90SHwM,32,28018,2819205,3626,The Ultimate Minecraft Villager Civilization Movie
1252,4.633,Z2QkgpUF7IM,0,9386,396033,547,What If The World Had NO PARENTS?!
1253,4.635,XfA-XIVPgJ8,0,8200,339384,784,What Will Happen In Poppy Playtime Chapter 5?
1254,4.6369,X4Dg-DSacg8,12,26251,2418764,5983,Testing Scary Minecraft Seeds To Solve Them…
1255,4.6388,Wz9_EpTzE6o,0,44757,3551184,7240,Testing Scary Minecraft Seeds That Are Unsolved…
1256,4.6563,ysJf1IDf8F0,0,8137,865727,307,Why It's Impossible To Beat This Man...
1257,4.6584,vr_6FOrzFms,22,39110,628467,1835,The Jewish Doctor Who Tricked The Nazis
1258,4.6604,kPBlcgbmiHE,1,30886,1430121,751,World’s RAREST Discoveries…
1259,4.6625,carh_grJVgU,1,7475,813226,919,I Google Translated Sprunki Retake 100 Times
1260,4.6646,byVx-XgjTDs,3,78148,2068943,4566,This Enderman Exists in Vanilla Minecraft
1261,4.6666,W9xKRK5KlHU,0,13077,929572,1797,Poppy Playtime Chapter 4 TRY NOT TO LAUGH CHALLENGE!
1262,4.6685,UhYg7QeaAiA,20,44720,881521,1964,The Darkest Shooter Game Ever Made...
1263,4.6705,UZEr6DVSNR8,0,1805,46652,156,Luckiest Moments in Football
1264,4.6725,ThIZFp_5dhA,0,2799,457164,29,which mob is faster
1265,4.6745,SXIBSDuiWA8,0,52712,5342491,11623,Testing Scary Minecraft Seeds To Prove Them Fake?
1266,4.6765,SPmty0YniVo,0,993,6102,43,Doey Splits His Body Into 3 Kids ?! - Part 3 // Poppy Playtime Chapter 4 (AU) - COMPLETED EDITION
1267,4.684,QudVcBFXAo8,0,59076,2871591,1439,ALL of your Minecraft questions in 489 sec
1268,4.6859,QCyQGUBE7q4,0,12158,371881,1004,I Dug To The Center of the Earth and FOUND THIS..
1269,4.688,QC2ZnGLHlo0,23,72877,5426967,6354,Testing Scary Minecraft Myths To Solve Them
1270,4.6899,PW0sIXnx8ik,0,69,2926,1,Angels Vision News | March 18, 2025
1271,4.6917,PPs2t-u9Hog,25,32803,2425615,1559,I Was MURDERED...
1272,4.6937,OAbP-V6fEVc,2,3895687,198476950,197512,I Broke Into A House
1273,4.6957,O6EIhuoMs4E,0,22462,1090417,569,You Had One JOB!! (Design Fails)
1274,4.6978,O0EShM655h8,0,49893,5747126,3056,A Raft For Balls | Golf-it Funny Moments
1275,4.7101,vxiuHlKwsnM,0,63828,5212447,4258,WE'RE IN A VIDEO GAME! Riverbond!
1276,4.7122,vsDKxCzxKYo,3,163596,29416382,6810,Baby Blobby - Snipperclips
1277,4.7142,tIArdT4oSnk,1,10140,923160,712,Top 10 Disney Fails & Animatronic Malfunctions Pt 21
1278,4.7163,hWk7UKIunD0,0,843,1715613,83,CAT HACKER! Grandma's PC is Mine Now!
1279,4.7343,v3tu3MrMm8Y,0,416,373350,63,What Happens When a Cat Meets a Grumpy Dog?
1280,4.7365,nt51uFmKZmo,0,1180,1870144,97,Saving a Puppy at the VR Pet Hospital
1281,4.7384,n5ByVudZ-Es,0,15707,1103243,1426,I Built 10 Incredible Cat Forts!
1282,4.7404,cqftZDM7XQQ,1,10383,3515763,0,Disney Cartoons Come to Life | Every How Not To Draw...so far ✏️ | Compilation | @disneychannel
1283,4.7527,bBzK6YdFf2c,0,344,705607,67,You’re FIRED! The WORST Boss Ever? Job Simulator VR
1284,4.7546,S9ZzBP2p_IE,0,671,2578194,87,It Bit Me! Off to the Vet Hospital!
1285,4.7568,RfhYaF-Ffvk,1,438,45120,36,Henry Stickmin: 👮‍♂️ Jailbreak FAIL! 🤪 (And How I Escaped!) 🏃‍♂️
1286,4.7588,QhbxbMN99HU,1,64490,1694589,8186,Squishy Makeovers  Fixing Your Squishies #38
1287,4.7609,PrYUGwRtHPQ,0,166444,15875920,7076,Being The RICHEST Girl In Minecraft MONOPOLY!
1288,4.7629,OHxw0Ji0b3M,0,3558,711584,224,BABY destroys the entire HOUSE - I Am Cat VR
1289,4.7649,MxdgqaAmkXs,0,22204,1101403,2539,Best iPad Art Wins $10,000! ft. Ben Azelart
1290,4.7672,MsgwfA7KWno,0,12656,695257,282,Minecraft: 5+ NEW Mini Biomes and Structures!
1291,4.7694,Mle2qg_OXp4,0,68820,9941408,1925,This Minecraft Video Will Make You Relax
1292,4.7713,LrPBm3PlzfA,0,696,40041,52,Most UNEXPECTED Animations You CAN'T UNSEE
1293,4.7733,KSKJKLmAqpI,0,2745745,146958692,55127,Lamborghini Race, Winner Keeps Lamborghini
1294,4.7752,KBi4YTjhqLM,1,24252,2136682,1669,The EASIEST GAME On Roblox IS SO FRUSTRATING!
1295,4.7774,JTQcIR2ZxU4,1,4243805,189608443,80232,Homeless Man Buys A Lamborghini
1296,4.7794,IoZri9hq7z4,1,4132166,143326897,85226,I Uber’d People And Let Them Keep The Car
1297,4.7939,urtFrxDUV6c,0,3652501,182392943,82954,Would YOU Quit School For $100,000?
1298,4.7961,qK_qK_UKu-Q,2,1243141,94177435,13739,Most Expensive iPhone!
1299,4.7982,oyPk5rUwCEM,0,16992,862149,572,I tried to protect the president and this happened
1300,4.8002,idfJEicYrpU,1,25500,573352,1161,$1 vs $10,000,000 Road Trip!
1301,4.8023,ZHxAkxGBUhc,0,1279540,57410447,35892,Donating $50,000 If You Beat Minecraft!
1302,4.8044,QqMnwsoXq84,0,5709,444837,1052,I Found a Lamborghini BURIED in my Backyard!!
1303,4.8064,IYVjOfoU3uI,0,4096079,196708239,97329,I Gave My Credit Card To Random People
1304,4.8086,I2mBN09k8Zk,0,37841,3149655,10049,Testing Minecraft Legends To See If They're SCARY...
1305,4.8105,HO0KNuGa4KM,1,24850,2494719,1220,I Did Every Minecraft Challenge in Real Life!
1306,4.8125,GgEnoMXnaD0,14,33486,2785085,9449,Testing Haunted Minecraft Seeds To Solve Them
1307,4.8245,wFOD3WSfzjo,0,2871,120198,310,Minecraft, But There's CARTOON Hearts...
1308,4.8389,y1O9QsUQIcc,0,6759,809879,805,The Bloop vs Security House - Minecraft
1309,4.8409,t8Ys6gzwi1Q,1,32916,2237469,2271,Testing Rare Minecraft Villager Seeds...
1310,4.843,gaSrJK7UH9A,4,55808,3281968,9146,Testing Minecraft Lies That Are Scary...
1311,4.845,aMslNRuqupk,0,61923,8751409,1486,Minecraft, But There’s Rainbow Friends Hearts
1312,4.8473,QpwJEYGCngI,1,823294,49098155,14806,You've Never Seen A Wheelchair Like This
1313,4.8492,QnUg67G-VM4,0,320279,21265883,7015,Trapped In POKEMON In Real Life!
1314,4.8513,OpxIh-ggFuY,2,43106,4029488,12739,Busting Scary Minecraft Seeds To Prove Them Fake
1315,4.8532,I4yE1Qoftyg,0,67421,6715880,2235,Minecraft, But I Can Upgrade Myself
1316,4.8552,FxlwbhBfd3c,0,13350,658403,1806,What If Poppy Playtime Joined DOORS?!
1317,4.8571,FoGKOy9Pb10,0,9252,311778,1911,Boy Gives HAIR LICE To The Whole School
1318,4.8591,FjUMFPE9AEw,1,7221,349430,474,SINGLE MOM With Baby SHAMED At DMV | Dhar Mann Bonus!
1319,4.8611,FYwrZ21dDOY,6,71891,9741802,2998,Trapped on One Peppa Pig Block in Minecraft
1320,4.8632,FTi9WYR4Cds,0,6953,286023,330,We Forged a Katana from 1M paperclips
1321,4.8651,F73SrtgBozo,0,52304,1719284,6013,Unboxing Pre-Release Poppy Playtime Chapter 5 Mystery Box!
1322,4.8671,F6PqxbvOCUI,0,4095925,147503680,80794,Protect The Yacht, Keep It!
1323,4.8692,EyFBIavy-pQ,0,9,299,1,The Results of our "2 week phase" in Minecraft (2024)
1324,4.8712,EQB9DTXJus8,0,2218,280687,219,I ARREST Anyone I Draw! *Criminal Sketch Artist*
1325,4.8731,Dp2XNvZAGYE,0,22802,2208821,947,If I QUIT This Game, He DIES… (Bit Buddy)
1326,4.875,D5tvW00SZFc,1,838701,56726312,13952,Would You Rather Have $10,000 or This Mystery Box!
1327,4.877,D3s14gpmea4,1,8431,1671570,159,Mark Rober Reacts to Kids Genius Inventions
1328,4.8802,D06DNx3xF0A,0,3927,2790460,192,World’s FUNNIEST Peppa Pig Animations
1329,4.899,utHgfyS1RSw,0,6192,499673,949,Try Not To Say Aww! *IMPOSSIBLE*
1330,4.9009,tWH27J358U4,0,95436,2372024,12895,I Got my First Piercing and Hid it From my Mom
1331,4.903,rkzHgNYPITc,0,34505,9844745,1493,Using PROFESSIONAL Builder To Cheat In Building Challenge!
1332,4.9049,lVXK2nka4HY,0,11125,1352648,469,Peppa Pig TRY NOT TO LAUGH Animations You NEVER Seen?!
1333,4.9069,lK7cGdFdKOc,0,9911,1355735,682,FUNNIEST Peppa Pig Animations (Cartoons)
1334,4.9089,ksPjSNVfXwQ,0,4038,321975,349,DISNEY Dress To Impress In Real Life!
1335,4.9108,jOU6_a9vrO0,0,62401,30455814,6450,LIFE SIZE LEGO builds...
1336,4.9128,bh7JuARiWTk,0,1620,171334,76,Peppa Pig FUNNIEST Memes and Animations EVER MADE
1337,4.9147,V6H5nZP3ndU,1,6442,674739,496,SADDEST Animations On The Internet
1338,4.9168,I4pI3Y3PVvY,1,1303,74423,97,What if Peppa Pig was in Among Us! *Animation*
1339,4.919,CvPtDd3B3PE,2,110274,1850026,3423,We Saved 100 Children's Hearts in Africa
1340,4.9211,CkDcE7GbIoo,0,11928,1011851,1636,Peppa Pig FUNNIEST Minecraft Animation!
1341,4.9231,Cgl5MZ3TduY,0,21837,830946,911,The Video Ends when I 100% Mario Odyssey From Memory
1342,4.9354,vzbkGCLC-H8,1,218,5119,76,How Big Is Lumiose City? Pokemon Legends ZA Vs. Legends Arceus
1343,4.9375,lcLpV8vYUg4,1,90733,3894569,3509,REAL or CAKE with Nick DiGiovanni
1344,4.9394,fMPTSiOuNpA,8,181462,9357191,4909,I beat Breath of the Wild 100% In a single day
1345,4.9415,_He5Bz9cHLY,0,34751,2008891,942,Attempting YOUR Custom Mario Odyssey Moons
1346,4.9545,w22ihx6V0K4,0,35513,2289623,1173,Finding YOUR Custom Moons in Mario Odyssey
1347,4.9565,v9B_bvrJbJE,9,22634,496368,543,How fast can four people beat Mario Odyssey?
1348,4.9586,rOIjKmVfj5k,0,13657,288622,560,Every 5 Minutes I Spin the Wheel...
1349,4.9607,hTtt58rJJys,6,57744,4869796,2490,Mario, but if I say "Tank" 10 tanks spawn
1350,4.9628,WSFAOuvnGN4,0,24,1732,5,I beat Mario Odyssey without touching coins or water
1351,4.9649,VqjdaQkt0bM,0,3248,121349,225,Tears of the Kingdom's Randomizer Broke Me AGAIN
1352,4.9668,UzyTl7Uu8GQ,4,64188,1176182,2522,I trained an Ai on 380,000 Twitch Chat messages, but it was "too hateful"
1353,4.9689,LLRM33MU-UU,0,30235,1665485,1034,I Let YOU Create Custom Mario Odyssey Moons
1354,4.971,KkDYf37nu_c,2,27215,1094894,916,Revisiting .io Games in 2025..
1355,4.973,GYIOD1g4Eic,3,19554,778371,595,Mario Odyssey but every moon makes Mario faster
1356,4.975,CAfVvuDyVVw,3,14554,442168,592,I Ranked EVERY Frozen Burger in America
1357,4.9769,C9I-NX4TDlY,13,94651,2551896,3562,Mulan explained by an Asian
1358,4.9789,C617B8Ya3_w,2,20958,532513,959,Snapshot Null: A Minecraft Mystery
1359,4.9808,C3dPRLkqW60,13,34817,1575044,2755,How a YouTuber's Death Determines Their Legacy
1360,4.9826,C34dkaZIDpg,0,2199,149578,216,SUPER Secret Glitched Hiding Spot - I Am Cat VR
1361,4.9845,BpWFmzh_GEk,5,202199,8089011,13105,The Fitness YouTuber Who Went Clinically Insane
1362,4.9865,BoKlj7Lx_os,0,28934,3177677,891,Evolving as a Wither Storm For 100 Days in Minecraft
1363,4.9885,BmicBpOXPlc,2,176155,11220836,4623,I Tested 1-Star Restaurants
1364,4.9904,Bkj9eA77WLU,0,346638,21697714,20418,I Tested 1-Star Airlines
1365,4.9922,Bh-78d0Ru9s,2,29874,780936,1050,I Made a 30,000,000 Block Ender Pearl Cannon
1366,4.9943,BbsCT92Qs-o,28,56397,1017054,2134,They Added My Character to Make Way
1367,4.9962,Bb1KNFEOFaA,0,36614,2479389,3166,Smithville - The Strongest Tornado in Recorded History
1368,4.9983,B_h9JUWK2fc,0,12875,416675,1850,Minecraft - Hit The Target's Funland [761]
1369,5.0005,BYpXGbQ0e_M,0,6359,557288,363,I Built LEGO Mario vs Sonic Mechs
1370,5.0025,BXPtgg9vxCM,0,1114,33043,143,The Biggest SECRETS Of Mario Kart World
1371,5.0045,BVnk2k54B6s,17,11943,1203634,1639,The Full Story of WORMHOLE: Minecraft’s Deadliest Exploit
1372,5.0064,BT_q9bxbTAY,13,5,374,0,I Hurt Grandma! I Am Cat. VR Funny Moments
1373,5.0084,BRdcyDrIRDo,0,51,14365,3,Buckle Up for Laughter! Moments of the Week: Epic Fails Edition!
1374,5.0103,BR_G-T2Mw24,3,16901,1183122,776,MINECRAFT Things at DIFFERENT AGES!
1375,5.0124,BQlPjnejpps,0,32446,8881395,4141,Minecraft Xbox - Andromeda - Space Hunger Games - Round 1
1376,5.0178,Tg95OJbHmLI,2,12143,3260209,2162,Minecraft Xbox - Andromeda - Space Hunger Games - Round 2
1377,5.0255,T-HWw2pybfU,1,64242,1000112,2663,Hermitcraft 10: Episode 30: THE NEW BRANCH!
1378,5.0424,vp_dzqZXgMg,0,344510,3903104,19623,My Biggest Hyperfixation Yet.
1379,5.0446,qSmBiwREamo,0,46304,364670,6000,I DIED IN HARDCORE MINECRAFT...
1380,5.0465,pLrG1cZURTo,0,64061,1051323,2217,Hermitcraft 10: Episode 31: PERMIT MANAGER AGAIN!
1381,5.0486,fBpQlCfkVDY,0,10,1302,11,I Have a Theory: HermitCraft Theory
1382,5.0505,TYpbubUHwlc,4,2349,87210,140,I Survived 100 Days in Solo Leveling Minecraft on One Block!
1383,5.0525,PtEa-Ne_CJ0,1,10122,2680760,1194,Minecraft PC - Hunger Games - W/Stampy + InTheLittleWood
1384,5.0546,Ow0tZt5b6tI,2,21791,255335,952,Permit Office SECRET Bunker! -  Hermitcraft Episode 36!
1385,5.0566,OoOMHj07gIY,0,18180,3595973,3604,Minecraft Xbox - Battle Ship Royal Vs Choo Choo/Superchache
1386,5.0585,MtA9gS0wBtA,0,2487,105314,161,Reacting to SUPER POWERFUL NPCs FIGHT!
1387,5.0604,BQS4kLal7-k,6,42998,2538011,1616,you laugh you restart, laugh again you restart again 😂
1388,5.0624,BQGLbTesSxQ,2,17489,842244,816,The First Play - SNL
1389,5.0644,BPK3TZce-3g,1,63796,2106850,5998,The Luka Conspiracy Goes Deeper Than You Thought
1390,5.0665,BOXLTwrXjU8,0,28048,430898,981,Phasmophobia but we're LOCKED IN.
1391,5.0684,BKq-g_aNbuA,3,479744,22390216,14344,SURVIVING 24 HOURS IN A CITY WITH NO LAWS!
1392,5.0705,BIUPKhqbi-U,5,70596,1879949,2482,Hermits Play Among Us
1393,5.0725,BFlYwm9khMo,0,133717,2917984,3879,I Built a Castle in Minecraft and asked my Friends to Break In
1394,5.0744,BCFH2n-Op_I,0,87311,2671320,2794,memes but try not to smirk or giggle
1395,5.0927,yIX728tGfZ8,10,1268,27751,130,Offensive Memes if ylyl v1183
1396,5.0948,tGVGtqIW46I,0,94292,4864446,3956,Memes I Stole Pt: 3
1397,5.0967,i4ZtIwMMtGQ,0,195,9678,0,offensive memes to watch before sleep
1398,5.0988,hYNtXwUzpqs,5,43912,1553139,4333,The Worst School Shootings In History
1399,5.1008,XkklNEOwwNc,0,95,3628,15,Most Cringiest Video On The Internet That Will Make You Break Your Screen....
1400,5.1028,VCzVPdSeGeY,2,433,20748,28,offensive memes that if ylyl 5
1401,5.1047,UgGlLr3lPN8,2,23061,1499503,784,memes that end in perfectly cut screams 5
1402,5.1067,TApCjAthDf4,0,93564,2360920,5028,Every Real-Life Glitch Explained in 11 Minutes
1403,5.1086,R94JVz3BSCc,4,3065,83779,91,memes but if you laugh you gotohell
1404,5.1106,NLnNZyPed3k,2,6647,217561,312,memes but if you laugh you fall from the sky
1405,5.1126,FqtFXJ_Qwqk,1,102708,2342997,4054,Praying Mantis Fights Off Snake
1406,5.1147,BAXZujtQ1J0,0,10957,5429700,173,😂 Funny Videos Every Days || Best Compilation of Fail and Prank Videos 😂 TRY NOT TO LAUGH #13
1407,5.1168,BAGCa4_uPfQ,0,2569,421551,45,I Became a RICH LEGO Tycoon from Being Homeless!
1408,5.1188,B5WUhJUog_M,0,867603,64893987,12021,iPhone Vs 8000 Feet Drop!
1409,5.1208,B50m5J2jqIg,6,1254211,35303280,46090,Minecraft, But If You Laugh You Lose REMATCH
1410,5.1227,B2fFOwjG4V0,0,1771,4787536,311,I Turned Into a CAT! You Won’t Believe What I Did
1411,5.1248,B-umZS6BcLM,0,12117,222693,1594,HUGE NEW GHAST UPDATE, TOTAL GRAPHICS OVERHAUL, + MORE - EVERYTHING ANNOUNCED AT MINECRAFT LIVE 2025
1412,5.1268,AzmeWJRcnBY,4,422468,8556992,17464,MILDLY INFURIATING
1413,5.1287,AydgwG_0WiU,0,14146,1486973,367,Using CURSED THOMAS to Fool My Friends in Minecraft
1414,5.1309,Au0LBowb_pM,0,8290,335557,970,Minecraft - Moving House [779]
1415,5.1328,AsBQa90E_O8,3,10991,1506077,972,World’s *CRAZIEST* Discoveries!
1416,5.1348,Ar0zgedLyTw,7,10654,83964,1702,They Didn't Make Dire Wolves, They Made Something…Else
1417,5.1367,AnCXEq76FcM,1,10827,405332,760,The TRUTH about StampyLongHead
1418,5.1497,s5-Sa_XW-Nw,6,52012,2354377,2755,What Happened To Team Crafted's Members
1419,5.1517,r3XegOnyUKA,3,5731,225029,379,Why ShotGunRaids Abandoned his Audience… (Twice)
1420,5.1536,O3qIk3lrBqM,7,266909,8617696,11147,dream smp: oversimplified
1421,5.1557,LKugFX6s7-4,0,1948,50838,151,How DanTDM Changed a Generation
1422,5.1578,BLQEn856yl4,0,21855,445406,1047,I FOUND MY OLD MINECRAFT XBOX 360 WORLDS!!
1423,5.1598,AltzlEgXO_M,2,239664,9856578,10056,How Penguinz0 Destroyed YouTube's Worst Content Thief
1424,5.1617,AkaFUbX60FM,0,4450,88689,531,Blox Fruits But We Can Only See 1 Fruit!
1425,5.1636,AemfZ1Z7WAY,0,9124,302296,859,The Best Game I've Played This Year! (Astro Bot)
1426,5.1654,AcKM_e5ig_8,16,33961,1155171,6163,Bill Burr On The Problem With Billionaires, Fake Wokeness, Elon Musk, New Special + More
1427,5.1674,AcA6wKibT18,7,27495,1418307,1094,What Happened To Stampy's Helpers
1428,5.1804,uzhy7RNazlA,1,130221,3789559,6041,How Pixel Gun 3D Lost 98% of its Players
1429,5.1825,tu0ys7j8d_g,0,17799,388574,831,How One Song Raised An Entire Generation
1430,5.1863,iIYvvSLblHg,2,37798,373869,11318,DO NOT BUY THE NINTENDO SWITCH 2 | Bearman3600
1431,5.1883,aCM40OTYAAo,1,9114,445381,595,What Happened To SSundee's YouTube Friends?
1432,5.1902,SD64lBx7r1s,2,66587,2454282,4045,The Return of YouTube's Worst Creep (Mini Ladd)
1433,5.1924,Ac97AZae-0E,0,2978,62889,441,How Many Rubber Bands Can Crush a Car?
1434,5.1944,AXp21IfAkM0,17,47263,8848909,8250,Testing Scary Minecraft Lies That Were Forgotten
1435,5.1964,AWjJu701qzM,3,18423,489897,2633,I Tried 1-Star Experiences
1436,5.1983,AUcJWUH4d1E,3,46245,5288633,7102,Unstable SMP: The First War
1437,5.2003,ATVHcmymk6E,0,21686,664447,2252,Rachel Zegler LOSES IT After Minecraft Movie DESTROYS Snow White At The Box Office..
1438,5.2024,AQz1U6FNSFc,15,93807,3023766,5683,Most Hated Streamer is Pleading Guilty to Serious Charges
1439,5.2258,zDOgWDYPmSk,6,115699,2881987,7721,Absolute Losers
1440,5.2279,u9H3dXFv17Y,1,69168,1840038,4676,Tampa Is Better Than This I Swear
1441,5.2298,r7RIqq6ZXmY,2,49536,1331525,1689,Silly Car Serious Chase
1442,5.2319,qTh7PaudZLQ,3,35936,1182101,5209,Jack Doherty is in DENIAL He Destroyed His Career..
1443,5.234,mNXWORSXV3w,4,189982,6278751,6531,Youtubers Faked a Funeral to Scam Their Audience
1444,5.236,k9e088paSXM,5,114770,3368495,6553,He Won't Take No For An Answer
1445,5.2378,juXR3IJcOwI,1,31980,1236130,4547,Johnny Somali Is F*CKED
1446,5.2399,ey-ycoZQifw,4,161272,6972996,4727,Worst Speedrun Ever
1447,5.242,_RxZbmvZK6I,2,166386,4344422,9856,Most Delusional Freak Out Ever
1448,5.244,WhySWZ68q78,3,22786,744081,2305,The Deserved Downfall of Ellen DeGeneres
1449,5.2518,j0SaNVBJcHU,21,6975,213271,1694,Muslim College Student DUMBFOUNDED as Charlie Kirk Lists The Facts About Hamas
1450,5.2537,_uBLsHA8nas,8,2527,163058,404,Top 30 Times Celebs Were CAUGHT Lying
1451,5.2558,X-XG_FWXSto,9,30539,475557,3330,Chinese Single’s Inferno Made 4 Hot Girls Sleep With 4 “Best” Guys - Most Unhinged Dating Show
1452,5.2578,Q2zxl6dlEYo,6,136799,4222849,8198,I Paid $200 for Alpha Male Coaching
1453,5.2599,ONcQh3Ckqhw,3,14176,331848,3106,Dog Abuser Gets a Shocking Dose of Karma After Years of Cruelty
1454,5.262,IxnCc743jGU,1,81361,1669836,8788,Disrespectful IRL Streamer Destroys His Life in Korean Court In Front of Us..
1455,5.2643,H_wJQih0Yww,1,131485,2990169,8012,Stan Lee Exploitation Documentary is Crazy
1456,5.2663,AMoYhpgHe_8,0,44811,2464387,3438,One Direction Audition Tapes
1457,5.2684,AMoEuFPiZqQ,0,978,43334,120,I Put EVERY Sport Into A March Madness Tournament!
1458,5.2703,AMG3RxUXA0U,4,32495,1503292,3073,How A Face Reveal Determines a Reputation
1459,5.2723,AIKTk8dzqrM,1,99879,3906519,5573,Obsessed Twitch Viewer Arrested for Lighting Streamer's Car on Fire
1460,5.2741,AHE7eSKvjmw,1,14191,1389145,1038,I Bought the Most EXPENSIVE Minecraft Products!
1461,5.2762,ADYFW7vWvVg,2,20515,290482,4422,Naughty Dog has completely lost the plot
1462,5.2781,A6wNEUmLA8w,0,130360,4094182,6625,This Video Will Make You Hate Airrack
1463,5.28,A6GosR57xEE,4,24240,1084312,1748,I Infiltrated Lifesteal's Deadliest Empire
1464,5.2819,A59HbF3ofx4,1,11250,967832,2621,Minecraft Xbox - Herocriptic II - Ooohhh, PARKOUR - Part 1
1465,5.2839,A4rh6EqbYfU,2,53007,3956301,15020,Rich College Kids Take Police on 137mph Chase
1466,5.286,A42pz-YbWTQ,0,78399,6397880,4236,Dumpster Food Challenge ft. SORTEDfood
1467,5.288,A3nrcF1nFYY,0,112536,4769061,4565,The Many Scams & Downfall of Machinima (2006 - 2019)
1468,5.29,A2KhmZ3A0Ho,7,72986,4889406,3468,Minecraft Myths You Shouldn't Watch at Night...
1469,5.2919,A-Ok6ISfG4Y,0,18086,2212322,1348,Try Not to Laugh but its IMPOSSIBLE! (Challenge)
1470,5.2938,9zXfuL4IAZQ,0,18988,560666,1021,Discord’s Goofiest Drop-Shipping Scam...
1471,5.2957,9xp2IasKwFk,0,23188,1259934,2268,BECKBROS React To MEDIEVAL vs FUTURE STICK WAR!
1472,5.2977,9wSQ9Zk_9gQ,0,15655,359976,1069,Frozen orange juice is actually super weird
1473,5.2997,9ujBuMgUqjM,1,30409,1981366,1841,Poppy Playtime Chapter 3 RETOLD?!
1474,5.3015,9tvKby6YNJQ,3,85324,7360050,8536,Our Dog got Married and had PUPPIES! THE MOVIE *Emotional*
1475,5.3035,9spZ8STn5cI,0,5454,259928,675,Why I'm BROKE in Minecraft’s Pay-to-Win Civilization...
1476,5.3054,9qmfPvrm6ew,0,908374,57877962,38187,I Built a SECRET Zoo In My House!
1477,5.3075,9pxIRynjOQQ,0,28,8398,0,TRY NOT TO LAUGH 🤣🤣 Best Funny Videos compilation 2025 - Fails & Hilarious Moments😂#16
1478,5.3095,9j_YdXHSG8c,0,18507,4802633,2430,Minecraft Xbox - The Dropper - Part 2
1479,5.3113,9h3uWHe9l5c,1,17873,189247,2609,sneaking into mansions to poop in them and leave
1480,5.3134,9esTFmyWeW0,0,13431,518572,422,The PEAK Villain? - The Story of the Lich (Adventure Time)
1481,5.3152,9eSe8NLvqv8,0,13310,2122205,415,BEST OF MERCURI 88 TIKTOK COMPILATION | TOP 100 TIK TOK's OF MANUEL MERCURI
1482,5.3172,9dh3PwhQLZ8,0,46529,2460170,2941,I Found Minecraft’s Rarest Secret Seeds!
