order,timestamp_ms,video_id,flag_count,like_count,view_count,comment_count,title
1,0,ORIGINAL,0,0,0,0,[Unknown]
2,0.017232,26M-bU3wMBI,0,4170,114285,492,Allay Tag - Tutorial - New Mini-Game!
3,0.025337,0xihXAzral0,0,87929,18664748,12932,Minecraft Xbox - Disney Pixar - Hunger Games
4,0.04876,ujiBmHcyHBs,2,47962,3026910,13851,Wandering Toddler Leads Police to His Irresponsible Mom
5,0.05914,joJwqdCGVYs,1,217771,14285493,26717,25 Missing Kids Discovered Behind Secret Door
6,0.070331,lXF_squiTr4,1,88827,5326773,37096,Cops Discover House of Horrors After Young Girl Escapes
7,0.081331,h7XdSGZf3o0,0,36731,2476085,15518,Employee Thinks She Can Go Home After Stealing $11,000 in Lottery Tickets
8,0.092181,mJNVQulQXYo,1,448024,16978132,93289,ANGRY neighbor CONFRONTS me and CALLS the COPS while cleaning a yard
9,0.1024,TapIk0aq9B4,1,21992,917357,2787,Moments after Cops Witnessed PARANORMAL Activity
10,0.113792,IS6HTmKQHTA,1,27663,1734062,4881,When Good Cops Humble Evil Cops..
11,0.124592,qlu0KU-YERg,13,20021,593232,4362,Woman Horrified By What Police Found On Her Property
12,0.135783,WaTBel6zeZw,5,8651,374643,1823,81 y/o Mom Won't Let Her Daughters Move Out, Gets a Surprise From Cops
13,0.147655,Fr48Wnw0uew,12,82134,4640922,16591,Cops Unlock Predator’s Phone, Find Horrifying Videos of Missing Girl
14,0.158786,OLvWg0VV5gQ,7,234601,17133709,47007,The Moment She Realized She Killed 2 People
15,0.17164,2OJ0czveMMY,1,129498,11329843,73757,Racist Woman Arrested After Attacking Senior Citizen at the Airport
16,0.183602,-_IusfhHWds,12,14888,854540,4028,Mom Realizing Her Daughter Is a Murderer | The Interrogation of Iyanna Colon
17,0.194993,PgkpYM267vs,14,90357,5125768,21497,Cops Make Horrific Discovery in Woman's Soup Pot
18,0.207527,ZkVhjbL1MiE,5,59906,3208975,8646,When Cops RESCUE Dogs From EVIL People..
19,0.219239,bf-AkXfRllQ,0,53187,4130430,15848,The Most Insufferable Traffic Stop Ever
20,0.23063,iTAIGCcv5Tw,8,30689,1828476,5249,Cops Discover An Evil Mother's House Of Horrors
21,0.241771,ByA3AdmNm0s,0,7358,571893,1174,Supernanny vs. the Ultimate Bossy Child | The Cooke Family | FULL EPISODE | Supernanny UK
22,0.252992,aTQNs2jwRM0,2,32303,2582796,13071,Walmart Cashier Goes Crazy After She Gets Caught Stealing
23,0.263661,0kH9Kh1gn2M,4,75856,3764730,6312,Mom Discovers Her Daughter's Horrifying Crime
24,0.274281,GOPQegB7eQk,4,15517,901059,2321,Police Confront Irresponsible Mom, Then the Unexpected Happened
25,0.293347,NVH79ehGfY0,0,859361,57637188,25427,The Best Of The Internet (2022)
26,0.304257,C-UOSxZh8Rc,0,13385,2329179,1260,1 Hour and 30 Minute of Daily Dose Of Internet (Part 2)
27,0.315699,ikDMbdMgbnM,0,95517,2064127,4207,This Blew Her Mind
28,0.327691,tZPQaihwZRA,0,258947,20689195,11487,Craziest Nature Videos of the Decade
29,0.339283,Dj1Sr2DS07o,6,3832,510858,311,ONE HOUR of Daily Dose of Internet (No Intros & Outros!) - 2024
30,0.349893,6_Py9INA4lE,1,57250,9967014,2910,People Having A Bad Day | Funny Fails Compilation
31,0.361955,LO886VqoC00,0,5257,196575,529,Astrophysicist Rates The Science Of 9 Outer Space Movies And TV Shows | How Real Is It? | Insider
32,0.372395,FGgtwEQ-BTk,1,997227,38573401,54251,The Best Of The Internet (2020)
33,0.382654,BCFH2n-Op_I,0,87311,2671320,2794,memes but try not to smirk or giggle
34,0.395007,1mj1BEVlO5M,0,28083,1088854,607,Gumball Out Of Context Is Hilarious
35,0.406939,tGmmQ688Fkk,26,26263,1813339,1014,Vine Compilation that gives me my will to live also RIP Vine
36,0.418441,KGBGXZTQ_KI,2,326585,9929118,9408,Can You Actually Beat Minecraft From One Grass Block?
37,0.429912,VCzVPdSeGeY,2,433,20748,28,offensive memes that if ylyl 5
38,0.439991,hYNtXwUzpqs,5,43912,1553139,4333,The Worst School Shootings In History
39,0.45037,R94JVz3BSCc,4,3065,83779,91,memes but if you laugh you gotohell
40,0.478553,NLnNZyPed3k,2,6647,217561,312,memes but if you laugh you fall from the sky
41,0.489133,yIX728tGfZ8,10,1268,27751,130,Offensive Memes if ylyl v1183
42,0.499672,TApCjAthDf4,0,93564,2360920,5028,Every Real-Life Glitch Explained in 11 Minutes
43,0.509981,5w9fSzdZNu0,0,14962,537768,485,memes but if you laugh you Tom Holland
44,0.521503,UgGlLr3lPN8,2,23061,1499503,784,memes that end in perfectly cut screams 5
45,0.533505,dwaXp-Rnf7I,0,324810,2565784,39527,Parkour Horror GAME SHOW!? [Finding Frankie]
46,0.544877,tGVGtqIW46I,0,94292,4864446,3956,Memes I Stole Pt: 3
47,0.556378,XkklNEOwwNc,0,95,3628,15,Most Cringiest Video On The Internet That Will Make You Break Your Screen....
48,0.56823,i4ZtIwMMtGQ,0,195,9678,0,offensive memes to watch before sleep
49,0.580633,xWs6Qij112Y,0,116988,7224061,9896,The Dumbest Drivers Ever
50,0.592686,e0h0NaMrPis,12,38565,531290,1307,Iron man explained by an idiot
51,0.60568,0_aJLPNMsQs,4,17425,699510,537,memes that got tiktok banned
52,0.619886,FqtFXJ_Qwqk,1,102708,2342997,4054,Praying Mantis Fights Off Snake
53,0.633111,fJLu4WknoxI,4,39453,1990605,5245,When Cops Raid Wrong Houses
54,0.650594,NkwOfPw2wZM,2,5576,854948,145,Best Fail of the Year (So Far) 2024
55,0.660813,HOmoZXA2iao,8,22811,1463244,2646,Minecraft But I Survive In FOOD CIVILIZATION [FULL MOVIE]
56,0.671753,lC9emrW0F2o,1,138541,12370503,5715,The Best Of The Internet (2024)
57,0.682754,LZs_hH-CQKk,0,159741,4579272,4226,Worst Time to Drink This
58,0.693213,253DiiFjVak,0,193549,35274084,4605,Top 100 Fails of the Year🤣🤣
59,0.703963,NLDCV8IfNsM,2,55408,2430836,7600,Officer Caught in a Real-Life Horror Movie
60,0.715575,PZt1vnxonJk,1,426151,28139355,13493,The Best Of The Internet (2023)
61,0.729361,8PbXYWK-SJk,0,22570,4577583,775,Best TikToks of Summer 2024
62,0.739901,lk4B2pt2qFs,0,26566,4942338,0,IMPOSSIBILE CHALLENGE : Try Not To Laugh | Funniest AFV Vines
63,0.75048,tc5nhTyZd6o,0,4907,884941,355,1 Hour of Daily Dose Of Internet (Part 7)
64,0.761701,R6Zy_BYGaSU,0,3469,101091,188,Fails of the Week | Backfired in Their Face 💥
65,0.773994,U7TCIEmotdI,0,33486,1378429,2587,I Spent 100 Days Hidden in a Secret Minecraft Base...
66,0.788792,JTDllO5y3Ak,0,28787,753259,802,How I WON Mojang's Map Making Contest
67,0.800474,thn7fYe9tQg,0,245696,7735725,6136,Breeding Pigs Until This Server Bans Me
68,0.811724,nLfzf2LElsA,2,103469,3926324,6584,Joining The Deadliest SMP (again)
69,0.823226,WL8ye_MLsZU,0,16189,916930,1137,I Survived a $200 MILLION Bounty
70,0.835018,Jl6s6SttN0s,0,250912,11796545,5563,I Built Minecraft’s Most Hidden Bases
71,0.845959,olL0XFoPRZk,1,83612,11052391,9598,Escaping Proton: Minecraft's Most Secure Prison
72,0.857139,vt8Z-lO8gmc,3,67891,2516189,2300,Every Unique Item Expands the Border
73,0.86823,vrtAgbKwXlk,0,6212,366295,711,The DARK TRUTH about Minecraft MOBS...
74,0.87881,KMkJjQ6nVSk,0,16235,633945,931,I Secretly used GUNS in Minecraft...
75,0.888187,cAgOtuVIgRw,0,47673,4380540,936,Minecraft, But You Mine 1,000,000 Blocks!
76,0.896793,yWu0vF160rA,2,8209,329272,388,100 Players Simulate Minecraft's Deadliest Purge
77,0.90594,oDmAQFVC9vg,1,150005,4849621,5288,How I Ruined this Superpower Server
78,0.914637,yGVa9Ots_fg,2,13767,1111738,1082,I Found Minecraft’s Rarest Secret Room!
79,0.922792,ihyluPPzHig,2,27613,568124,2182,How I Obtained Lifesteal's Only Mace
80,0.93224,QylrQhP8dqc,0,213383,12638241,5018,I Got The Worlds Best Minecraft Armor
81,0.941457,iZRwPq_MXJ0,2,187809,10281225,3386,X-Raying Until This Server Bans Me
82,0.951385,iJk8BPKtxLs,3,31868,1773227,1308,The Legendary Secret Tree Base in Minecraft Hide or Hunt
83,0.961103,DZo_OZohjgs,0,26377,704090,1184,I Let 1000 Players Build My Base
84,0.970501,o6vpguNzaBA,2,67719,4831728,1731,I duped 3,600,000 items in Minecraft…
85,0.979718,blTD03napcA,1,6204,200374,465,Fortnite is TEASING Season 3!
86,0.990658,OA2j8J_HuoE,1,72664,2149017,2775,Minecraft Manhunt, But Anything I Say Happens...
87,1.01603,L5fXbIsRR7A,2,8015,309796,691,Is Random Better Than Mashing One Button in Mario Party?
88,1.02223,4I98SqgIETM,1,48500,2461503,951,How Many Courses Can You Drive Backwards In Mario Kart 8 Deluxe?
89,1.02819,Sf2CGwJISSw,0,18587,1136768,686,Can You Win A Race in A Straight Line?
90,1.03494,Nn_L0B9B6UM,0,36849,1183012,781,How Many Courses Can You Drift Infinitely On In Mario Kart 8 Deluxe?
91,1.0412,nGgpNjxYOiA,0,9920,331157,327,What If Minecraft Looked Like A Cartoon?
92,1.04751,OQo5QURSxUc,0,7443,733688,229,Reacting to Every World Record in Mario Kart Wii... with Ultra Shortcuts
93,1.0538,FywVt7V8xik,0,13490,1013658,750,I made EVERY Track Harder in Mario Kart
94,1.06042,6g17cJ1FYcw,2,52625,2694200,1504,Smash But Jumps Heights Are Canon
95,1.06659,6knAoUvaIRw,1,13370,378974,374,Can You Trigger Lakitu In A Battle In Mario Kart 8 Deluxe?
96,1.07305,9dOrsJ2rR38,0,7421,296966,430,Can you WIN a Mario Kart race with RANDOM inputs?
97,1.07946,PWLlMlGyrg4,0,7412,204687,236,The Quest To Collect Every Coin In Mario Kart 8 Deluxe
98,1.08561,OHNyXOAxRo8,0,9778,332834,337,How Many Tracks Can You Beat Entirely In Offroad?
99,1.09665,E8IuWQARv3E,2,6118,857967,164,Impossible Puzzles Only the Smartest 1% Can Solve
100,1.10344,Up4vDwBCpo4,2,6663,244227,460,I Recreated OG Mobile Games in Minecraft Hardcore!
,1.10344,[TOTAL TIME ELAPSED],,,,,
