order,timestamp_ms,video_id,flag_count,like_count,view_count,comment_count,title
1,0,ORIGINAL,0,0,0,0,[Unknown]
2,0.016862,26M-bU3wMBI,0,4170,114285,492,Allay Tag - Tutorial - New Mini-Game!
3,0.024807,trdcprWAaMQ,0,474724,36707882,15756,Break This Ball in 1 Minute, Win $1,000!
4,0.039865,ns5wpAYUwss,3,27361,1996423,1872,I Transformed an Abandoned Turtle’s Home
5,0.047409,kiGjSA8NPpo,10,64448,8325914,3067,How Long Can The Worm Get?
6,0.062337,XZZdcai1oIE,0,73045,8279423,4885,Level 1 to 100 Minecraft Science Experiments
7,0.071964,4fvcPDyIlIA,2,15768,1779156,1574,Minecraft Items in REAL LIFE! (Animals, Items, Blocks)
8,0.082154,7m0_8AxgbDY,0,47216,4860271,1772,How Big Can the Wither Storm Get?
9,0.092242,jhfy8axRH-U,0,68294,6326713,7992,I Tried Eating Every Minecraft Food in Real Life!
10,0.103714,2zZpDANhH88,0,8216,482341,289,100 Mystery Doors, Don't Open the Wrong One!
11,0.113602,BoKlj7Lx_os,0,28934,3177677,891,Evolving as a Wither Storm For 100 Days in Minecraft
12,0.123691,kkd96ca-U2Q,0,39601,1706304,4207,I Got Hunted by a Minecraft Redstone Genius
13,0.13401,T9VzDHrCn6U,0,9134,296820,1432,We Defeated THE WITHER STORM in Minecraft
14,0.145782,NC7MUQdWRrE,2,36515,984873,845,Hunting YouTubers AS the Cave Dweller!
15,0.158706,umKCUsRvQeo,2,20146,435697,1189,100 Players VS ClownPierce
16,0.170428,EztPfrHRdR4,0,141924,6869856,6518,I Was Hunted by the Smartest Minecraft Players
17,0.181789,Bh-78d0Ru9s,2,29874,780936,1050,I Made a 30,000,000 Block Ender Pearl Cannon
18,0.194153,8Fpg0K0_n9Y,0,60729,1236001,2136,They Dared Me to Make a Minecraft Mod...
19,0.204101,PlGOst7Az9U,1,36765,965804,1921,I Broke 1,487,000 Blocks Under my Enemy
20,0.214701,4JyJCTNUEAc,1,38225,2017381,5087,I Got Hunted by Minecraft Bounty Hunters
21,0.225381,fZyItdzjI7I,5,12560,194984,1433,One Million Armor Stands
22,0.236451,ZeTQAuvjFLQ,4,45658,6961505,5960,I Survived Minecraft's Most Corrupt City
23,0.247422,TtVKfqquGwA,0,35007,1797140,3622,I Got Hunted by the World's Best Minecraft Player
24,0.259104,XUP23K1I8Xk,7,76107,1733690,2800,I CHEATED In Roblox Most Popular Games
25,0.270655,qBO1TXF8jdQ,5,103866,3528390,6352,I spent 2 months digging secret tunnels. Here's what happened
26,0.281666,itV8GMdJzJw,1,167803,2546316,8689,Every Stolen Redstone Build On The Dream SMP
27,0.292496,KMkJjQ6nVSk,0,16235,633945,931,I Secretly used GUNS in Minecraft...
28,0.303327,nNMheft9dko,2,20583,792708,1747,I Became Minecraft’s Demon Slayer
29,0.315018,17F1L7BtyKs,9,55105,806373,2705,bullying my childhood heroes for charity
30,0.326199,yIpms96cr1o,4,95302,2359441,3254,How Speedrunners Broke My Rage Game (Get To Work)
31,0.338762,olL0XFoPRZk,1,83612,11052391,9598,Escaping Proton: Minecraft's Most Secure Prison
32,0.348701,xnDjbV-C8i8,0,3690,110863,598,The Search for Minecraft's Last Tree [FULL MOVIE]
33,0.359942,WHmyvpA_EPY,3,26849,1103810,2093,How I RUINED My Friend's Minecraft SMP
34,0.430524,3c6EyKUHvX8,0,29073,2525395,3578,I Found EYstreem’s Secret Minecraft USB…
35,0.441254,HhvCr8NzDKI,2,41112,2723638,2546,MOST Viewed MINECRAFT Shorts! (250M+ Views)
36,0.451483,k7dKzwicrSY,0,56945,6178555,5033,Testing 100 JAVA vs BEDROCK Myths in Minecraft
37,0.461792,y2P4HVGD3lE,3,3447,438321,230,EVERY ILLEGAL Building Technique in LEGO
38,0.472712,-uQJfbRgeSk,0,20363,2106279,1557,What Can You Combine in Minecraft?
39,0.483523,YCYAHABlS5U,0,27942,3108159,6562,Weirdest Cartoon Mistakes You CAN’T UNSEE
40,0.493481,FDMq8i-TWps,0,166429,19847886,9031,100 Layers of BULLETPROOF GLASS vs BEDROCK
41,0.503981,89jvYGjAdrY,0,12844,1206043,755,Minecraft, But You Can Mine Anything!
42,0.514541,pcv5YLx_KHQ,0,14111,721714,712,World's Most *SATISFYING* Minecraft Shorts
43,0.526373,2OfnxVvhWE4,0,35939,3927504,1245,Testing Clickbait Minecraft Traps That Are Actually True…
44,0.537333,4mB-4SVGkn0,1,38780,2749718,4012,Insane Things Mojang REJECTED In Minecraft
45,0.549286,wWupCjGhOZo,0,32191,1488637,1780,I Found Minecraft’s Rarest Secret Seed…
46,0.560176,bI2Y8ro8Vvk,0,64071,3789550,1496,I Found Illegal Realistic Physics In Minecraft
47,0.570936,59fg4KiGmNI,0,541487,24853906,9034,Minecraft in Real Life if Ores Were SUPER!
48,0.581666,0FlohONbj-A,2,23934,2791462,2326,World's *STRANGEST* Discoveries
49,0.592195,Oc4NNnKfcAo,1,99285,5962683,2981,I Mined The World's Largest Minecraft Blocks!
50,0.623644,xzuhTTIIVe4,0,3785,138102,138,Reacting to 200 ZOMBIES vs EVERY GOD! (TABS)
51,0.634575,4HHSzM8PHwY,2,20045,2245576,1112,World’s HARDEST Try Not To Laugh Challenge!
52,0.645194,O2dN7CcHnSc,0,5849,539416,916,A Game About Digging a Hole
53,0.656015,lklzNxMtXp8,0,584096,41622309,11263,BUSTING 100 Minecraft Myths in Real Life!
54,0.666144,jDiEqO3hFUA,0,277327,26116413,4419,Minecraft But Everything I Touch Turns To...
55,0.676914,6Ex007JxiOQ,0,19970,592145,560,Reacting to 200 ZOMBIES vs the GODS!
56,0.687153,0zEy2NmqRBk,0,38726,3953673,308,200x SKELETON + 1x GIANT vs EVERY GOD - Totally Accurate Battle Simulator TABS
57,0.698354,rT46HL9DNzQ,2,5088,392952,224,*NEW* Genius 200 IQ Kid Inventions!
58,0.708192,la-xfa8Byfw,0,7319,155865,1033,IMPOSSIBLE LEGO builds...
59,0.760349,FOrsL3iqHLA,0,948,17223,96,World's FASTEST Workers!
60,0.77115,ZMHXrhkMcY0,1,9722,649397,454,World's *FUNNIEST* Minecraft Memes!
61,0.78734,-uQJfbRgeSk,0,20363,2106279,1557,What Can You Combine in Minecraft?
62,0.805223,iQTnWzfeGPI,0,55921,5440403,2333,Busting EVERY Movie Myth In REAL LIFE!
63,0.816544,wZWdGZER-_I,1,33268,3284056,1447,Escaping Maximum Security PRISON!
64,0.828547,qexqsEjfpvo,0,130200,10566875,6752,100 Layers of CANDY vs ICE!
65,0.976312,ysJf1IDf8F0,0,8137,865727,307,Why It's Impossible To Beat This Man...
66,1.01633,pqYYaq7JMO0,0,6800,488526,726,CRAZIEST Experiments In The World!
67,1.13553,Pdm0T_sV_Ww,1,745,179906,22,Multiblock Madness - 79 - Tier 6 Void Miner
68,1.17033,V8uZh_T6aow,0,71194,6794063,1272,Escaping 100 Layers of Rainbow Prison
69,1.18224,MR9q4IQhyyE,0,346332,24291238,10179,Minecraft But You Can Mine Anything
70,1.19328,lBSE6OwoMRQ,0,91317,7476982,4035,100 Layers of PAPER vs ROCK!
71,1.20445,a-Qo-yvO0AI,0,46240,4411125,3211,100 Layers of COKE vs PEPSI
72,1.21514,y3zoPdr0Q-M,0,65164,8262861,3054,100 Layers of RUBBER vs GLUE!
73,1.22557,1iJE8Lyvvls,1,299129,28115578,5342,How Many Bulletproof Glass Windows Stops This Wrecking Ball?
74,1.23598,gVxfQS0xvu4,0,10265,1065348,443,Science Experiments That Look Like MAGIC!
75,1.24706,-nRr1YBkcc0,2,15158,1887600,773,CRAZIEST Discoveries Ever Made!
76,1.25766,cK6SDiAog10,0,327684,12736416,2673,Breaking 100 Minecraft Laws In 24 Hours
77,1.26779,Ix5pH4b5ieY,0,8540,203150,631,Thank You Gamerboy! Saying Goodbye To Mzrp Relaoded 🎮👋
78,1.28197,9neR-6l90LQ,0,7268,274921,1334,I Escaped an Abandoned City!
79,1.29581,fc_1vycOqjE,21,71934,5752587,9388,Busting Scary Minecraft Seeds That Are Insane!
80,1.30896,-pgJ6booVpg,0,8930,962267,266,I Tested Every "Unbreakable" Product
81,1.32763,p_RI2V93jFY,0,51532,6174535,3660,Level 1 to 100 Satisfying Minecraft Experiments
82,1.33978,phV1_XIOMpI,0,172528,11051957,13819,I Collected Every Block in Minecraft, in Real Life!
83,1.35244,-gy2Br4fha8,1,35966,3175037,3275,What's Inside Minecraft Blocks and Mobs?
84,1.36424,Z-a280rc5P4,0,38779,3734472,2563,Destroy the Unbreakable Minecraft Block, Win $1000!
85,1.37582,hHdKug_wQkU,7,149032,8544455,6124,Walking on Water Prank!
86,1.38775,rTIibpJ6v-Q,2,33489,2941854,2506,I Cleaned Every Item in Minecraft, in Real Life!
87,1.39895,RNSMTcbzHZU,0,30134,1685655,1897,Realistic Minecraft - THE MOVIE (All Episodes)
88,1.41822,YCYAHABlS5U,0,27942,3108159,6562,Weirdest Cartoon Mistakes You CAN’T UNSEE
89,1.4294,lv1i8fWwDVY,4,29736,2572966,776,Minecraft, But I Become the Wither Storm
90,1.44066,EK9a0JbHnBc,0,279,16381,25,The Most SATISFYING MARIO Magnet Art!
91,1.45196,PC35HS8GXcw,0,12703,1071656,1242,Minecraft, But I Can Mine Anything
92,1.46254,fRKHN-quT8E,0,60146,6670776,7365,Disney Movie Recap Cartoons (Funny Animation)
93,1.47323,SjslOuaEC0c,0,45621,3616835,2768,Peppa Pig Family VS Minecraft! (Funny Animation)
94,1.48433,t-aeK8RzoUo,3,9126,577746,883,Reacting to Weirdest Disney Animations (Funny Cartoons)
95,1.4959,MtH2-QwIPGk,22,47121,5003923,5238,How Long Can Infected Sky Get?
96,1.50732,7bRGpNVbj5c,1,12687,731154,756,Try NOT To LAUGH (Moana Edition)
97,1.51758,4dDUWRWqcIo,2,1009756,36648353,19655,The Ultimate “How To Train Your Dragon” Recap Cartoon
98,1.52813,93dQiIVvvfI,1,10034,749697,2326,Reacting to All Your Pain in One Video!
99,1.53903,l4yLC3zljCM,1,28548,3260744,3334,Cartoon Logic That Makes NO SENSE (Funny Animation)
100,1.54941,Y8oHQ7-1LE0,1,67843,6046462,3756,I Survived 100 Days as TOOTHLESS in Minecraft
,1.54941,[TOTAL TIME ELAPSED],,,,,
